section,title,url
Energy & Environment,State regulators approve controversial Texas electricity market reform,https://www.houstonpublicmedia.org/articles/news/energy-environment/2023/01/20/441878/state-regulators-approve-controversial-texas-electricity-market-reform/
Pop Culture,How Houston became the biggest U.S. city without a theme park,https://www.houstonpublicmedia.org/articles/arts-culture/pop-culture/2023/01/19/441749/houston-biggest-american-city-without-a-theme-park-astroworld/
Technology,TikTok access wiped in a week at major Texas universities,https://www.houstonpublicmedia.org/articles/technology/2023/01/20/441881/tik-tok-access-wiped-in-a-week-at-major-texas-universitys/
Arts & Culture,Houston rodeo offering discounts for carnival attractions ahead of annual event,https://www.houstonpublicmedia.org/articles/news/arts-culture-news/2023/01/20/441829/houston-rodeo-offering-discounts-for-carnival-attractions-ahead-of-annual-event/
Criminal Justice,Sheriff Ed Gonzalez blames ‘inefficient court system’ for increasing deaths in Harris County Jail,https://www.houstonpublicmedia.org/articles/news/criminal-justice/2023/01/19/441699/sheriff-ed-gonzalez-blames-inefficient-court-system-for-increasing-deaths-in-harris-county-jail/
Transportation,Houston’s Bush Intercontinental Airport had third-most number of guns found by TSA in 2022,https://www.houstonpublicmedia.org/articles/news/transportation/2023/01/19/441740/houston-bush-intercontinental-had-third-most-number-of-guns-found-by-tsa-in-2022/
Food,Texas barbecue has seen a mix of mainstays and changes over the past 50 years,https://www.houstonpublicmedia.org/articles/arts-culture/food/2023/01/20/441893/texas-barbecue-has-seen-a-mix-of-mainstays-and-changes-over-the-past-50-years/
Food,Spanish Village Mexican Restaurant approaching end of era after 70 years in Houston’s Third Ward,https://www.houstonpublicmedia.org/articles/arts-culture/food/2023/01/19/441790/spanish-village-mexican-restaurant-approaching-end-of-era-after-70-years-in-houstons-third-ward/
Houston,"Swastikas in the mail: Houston’s Dr. Peter Hotez reports anti-Semitic, anti-vaccine harassment",https://www.houstonpublicmedia.org/articles/news/houston/2023/01/20/441904/houston-peter-hotez-swastikas-mail-anti-semitic-anti-vaccine-harassment/
Party Politics,State of the State,https://www.houstonpublicmedia.org/articles/shows/party-politics/2023/01/20/441846/state-of-the-state/
Houston Matters,"Plans to cut property taxes (Jan. 20, 2023)",https://www.houstonpublicmedia.org/articles/shows/houston-matters/2023/01/20/441372/plan-to-cut-property-taxes-jan-20-2023/
Houston Matters,"Rejected vanity license plate celebrates tofu…or does it? The Good, Bad, and Ugly of the week",https://www.houstonpublicmedia.org/articles/shows/houston-matters/2023/01/20/441374/rejected-vanity-license-plate-celebrates-tofu-or-does-it-the-good-bad-and-ugly-of-the-week/
I SEE U,"I SEE U, Episode 71: The Lion King of The Chicago Projects",https://www.houstonpublicmedia.org/articles/shows/i-see-u/2023/01/19/441748/i-see-u-episode-71-the-lion-king-of-the-chicago-projects/
Town Square,"Analyzing the Current Issues & State Bills Targeting the Transgender Community. Plus, Congresswoman Sylvia Garcia on her Goals for the new Legislative Session",https://www.houstonpublicmedia.org/articles/shows/town-square/2023/01/19/441808/analyzing-the-current-issues-state-bills-targeting-the-transgender-community-plus-congresswoman-sylvia-garcia-on-her-goals-for-the-new-legislative-session/
Health & Science,Houston clinic receives $1.6 million in federal funds to expand mental health services,https://www.houstonpublicmedia.org/articles/news/health-science/2023/01/19/441826/local-clinic-receives-1-6-million-in-federal-funds-to-expand-mental-health-services/
Health & Science,Some enrollees for Texas Medicaid health insurance will be ineligible for coverage under new rules,https://www.houstonpublicmedia.org/articles/news/health-science/2023/01/19/441817/some-enrollees-for-texas-medicaid-health-insurance-will-be-ineligible-for-coverage-under-new-rules/
Politics,"Texas’ proposed budget tackles property taxes, border security",https://www.houstonpublicmedia.org/articles/news/politics/2023/01/19/441703/texas-proposed-budget-tackles-property-taxes-border-security/
Houston Matters,"Sheriff Gonzalez on jail deaths (Jan. 19, 2023)",https://www.houstonpublicmedia.org/articles/shows/houston-matters/2023/01/19/441370/sheriff-gonzalez-on-jail-deaths-jan-19-2023/
Housing,Houston residential buffering code changes considered by city council,https://www.houstonpublicmedia.org/articles/housing/2023/01/18/441684/houston-residential-buffering-code-changes-considered-by-city-council/
Transportation,TxDOT hosts I-45 expansion meeting in Conroe as opposition continues to voice concerns,https://www.houstonpublicmedia.org/articles/news/transportation/2023/01/18/441648/txdot-hosts-i-45-expansion-meeting-in-conroe-as-opposition-continues-to-voice-concerns/
Town Square,Personal Finance Expert Suze Orman Shares Strategies for Building Wealth to Ensure a Financially Secure Future,https://www.houstonpublicmedia.org/articles/shows/town-square/2023/01/18/441659/personal-finance-expert-suze-orman-shares-strategies-for-building-wealth-to-ensure-a-financially-secure-future/
Education News,Conroe ISD removes ‘The Perks of Being a Wallflower’ from high school curriculum after parent’s complaint,https://www.houstonpublicmedia.org/articles/news/education-news/2023/01/18/441660/conroe-isd-removes-perks-of-being-a-wallflower-from-high-school-curriculum-complaint-by-parent/
Local,"Houston stargazers can see green comet in the sky during January, early February",https://www.houstonpublicmedia.org/articles/news/local/2023/01/18/441661/houston-stargazers-can-see-green-comet-in-the-sky-during-january-early-february/
Transportation,Southwest pilots union calls for May vote on potential strike,https://www.houstonpublicmedia.org/articles/news/transportation/2023/01/18/441655/southwest-pilots-union-calls-for-may-vote-on-potential-strike/
Politics,Texas lawmakers want to end state holiday commemorating Confederate veterans,https://www.houstonpublicmedia.org/articles/news/politics/2023/01/18/441649/texas-lawmakers-want-to-end-state-holiday-commemorating-confederate-veterans/
Business,Coffee chain employing adults with disabilities opens Houston location,https://www.houstonpublicmedia.org/articles/news/business/2023/01/18/441635/coffee-chain-employing-adults-with-disabilities-opens-houston-location/
UH Moment,UH Moment: Accomplished Academic Leader Diane Z. Chase Appointed as UH Provost,https://www.houstonpublicmedia.org/articles/shows/uh-moment/2023/01/18/441630/uh-moment-accomplished-academic-leader-diane-z-chase-appointed-as-uh-provost/
Houston Matters,"Expanding I-45 between Houston and Conroe (Jan. 18, 2023)",https://www.houstonpublicmedia.org/articles/shows/houston-matters/2023/01/18/441368/expanding-i45-between-houston-and-conroe-jan-18-2023/
Town Square,"NIDA Director Dr. Nora Volkow on Drug Addiction, the Opioid Crisis & Recovery. Plus, Actress Faith Jones on Her Role in Jesus Christ Superstar",https://www.houstonpublicmedia.org/articles/shows/town-square/2023/01/17/441580/nida-director-dr-nora-volkow-on-drug-addiction-the-opioid-crisis-recovery-plus-actress-faith-jones-on-her-role-in-jesus-christ-superstar/
Transportation,United Airlines opens its largest training facility at Bush Intercontinental Airport,https://www.houstonpublicmedia.org/articles/news/transportation/2023/01/17/441621/united-airlines-opens-its-largest-training-facility-at-bush-intercontinental-airport/
Police,Pedestrian killed in crash with Houston Police Department officer for third time in three weeks,https://www.houstonpublicmedia.org/articles/police/2023/01/17/441570/pedestrian-killed-crash-houston-police-department-officer-for-third-time-in-three-weeks/
Politics,Texas Gov. Greg Abbott talks property taxes and border security at inauguration for third term,https://www.houstonpublicmedia.org/articles/news/politics/2023/01/17/441565/texas-gov-greg-abbott-talks-property-taxes-and-border-security-at-inauguration-for-third-term/
