section,title,url
Politics,WATCH LIVE: The Jan. 6 committee is holding hearings on the Capitol riot,https://www.houstonpublicmedia.org/articles/news/politics/2022/06/09/426806/the-jan-6-committee-is-holding-hearings-on-its-investigation-of-the-capitol-riot/
Guns,New Texas gun restrictions are unlikely in the wake of Uvalde. Here’s why,https://www.houstonpublicmedia.org/articles/news/in-depth/2022/06/09/426501/new-state-gun-restrictions-in-the-wake-of-uvalde-are-unlikely-heres-why/
Politics,Texas House interviews DPS officials privately as part of investigation into Uvalde shooting,https://www.houstonpublicmedia.org/articles/news/politics/2022/06/09/426771/texas-house-interviews-dps-officials-privately-as-part-of-investigation-into-uvalde-shooting/
Hurricane,U.S. House approves massive $31 billion “Ike Dike” project to protect Texas coast from hurricanes,https://www.houstonpublicmedia.org/articles/news/hurricane/2022/06/09/426767/u-s-house-approves-massive-31-billion-ike-dike-project-to-protect-texas-coast-from-hurricanes/
Politics,"Parents of victims, Uvalde survivor testify before Congress over proposed gun legislation",https://www.houstonpublicmedia.org/articles/news/politics/2022/06/08/426658/parents-of-victims-uvalde-survivor-testify-before-congress-over-proposed-gun-legislation/
Criminal Justice,"2 Katy brothers arrested, accused of assaulting officers at Capitol insurrection",https://www.houstonpublicmedia.org/articles/news/criminal-justice/2022/06/08/426700/2-katy-brothers-arrested-accused-of-assaulting-officers-at-capitol-insurrection/
Houston Matters,The Full Menu: The best places for BBQ in Houston in 2022,https://www.houstonpublicmedia.org/articles/shows/houston-matters/2022/06/08/426593/the-full-menu-the-best-places-for-bbq-in-houston-in-2022/
Law,Simone Biles among women seeking $1 billion from the FBI over Nassar,https://www.houstonpublicmedia.org/articles/news/sports/2022/06/08/426651/simone-biles-among-dozens-of-women-seeking-1-billion-from-the-fbi-over-larry-nassar/
I SEE U,"I SEE U, Episode 46: Sugar Land Not So Sweet [Encore]",https://www.houstonpublicmedia.org/articles/shows/i-see-u/2022/06/09/426575/i-see-u-episode-46-sugar-land-not-so-sweet-encore/
Houston Matters,"Gymnasts sue the FBI, and returning to the office (June 9, 2022)",https://www.houstonpublicmedia.org/articles/shows/houston-matters/2022/06/09/426665/gymnasts-sue-the-fbi-and-returning-to-the-office-june-9-2022/
Town Square,"Aldine ISD drama teacher honored with prestigious Tony Award. Plus, wide receiver DeAndre Hopkins' mother inspires others as a survivor and advocate of domestic violence.",https://www.houstonpublicmedia.org/articles/shows/town-square/2022/06/08/426745/aldine-isd-drama-teacher-honored-with-prestigious-tony-award-plus-an-nfl-football-players-mother-inspires-others-as-a-survivor-and-advocate-of-domestic-violence/
Houston Matters,"Shrinking childcare options, Houston's best BBQ, and author Grace Li (June 8, 2022)",https://www.houstonpublicmedia.org/articles/shows/houston-matters/2022/06/08/426580/shrinking-childcare-options-houstons-best-bbq-and-author-grace-li-june-8-2022/
Town Square,Raising awareness of cancer survivorship,https://www.houstonpublicmedia.org/articles/shows/town-square/2022/06/07/426626/raising-awareness-of-cancer-survivorship/
Guns,Matthew McConaughey urges Congress to reform gun laws during emotional White House speech,https://www.houstonpublicmedia.org/articles/news/politics/guns/2022/06/07/426632/matthew-mcconaughey-urges-congress-to-reform-gun-laws-during-emotional-white-house-speech/
Politics,Uvalde mayor says he’s in the dark on shooting investigation,https://www.houstonpublicmedia.org/articles/news/politics/2022/06/07/426628/uvalde-mayor-says-hes-in-the-dark-on-shooting-investigation/
Energy & Environment,"Texas power grid can take this week’s spike in demand, ERCOT says",https://www.houstonpublicmedia.org/articles/news/energy-environment/2022/06/07/426622/texas-power-grid-can-take-this-weeks-spike-in-demand-ercot-says/
Sports,LeBron James and the NBA have not forgotten Brittney Griner,https://www.houstonpublicmedia.org/articles/news/sports/2022/06/07/426583/lebron-james-and-the-nba-have-not-forgotten-brittney-griner/
Criminal Justice,A prison bus collided with a truck in Conroe hours after Texas suspended inmate transportation,https://www.houstonpublicmedia.org/articles/news/criminal-justice/2022/06/07/426603/prison-bus-collides-with-truck-in-conroe-hours-after-tdcj-policy-change-on-inmate-transportation/
Criminal Justice,The long wait to confront the gunman at Robb Elementary is not what officers are trained to do,https://www.houstonpublicmedia.org/articles/news/criminal-justice/2022/06/07/426566/the-long-wait-to-confront-the-gunman-at-robb-elementary-is-not-what-officers-are-trained-to-do/
Politics,Supporters call for WNBA star Brittney Griner's release at Houston rally outside the Toyota Center,https://www.houstonpublicmedia.org/articles/news/politics/2022/06/07/426488/dozens-rally-outside-toyota-center-in-an-effort-to-bring-detained-wnba-star-brittney-griner-home/
Houston Matters,"Can the power grid withstand record energy demand? (June 7, 2022)",https://www.houstonpublicmedia.org/articles/shows/houston-matters/2022/06/07/426482/can-the-power-grid-withstand-record-energy-demand-june-7-2022/
Houston,Lakewood Church service interrupted by abortion-rights supporters,https://www.houstonpublicmedia.org/articles/news/houston/2022/06/06/426514/lakewood-church-service-interrupted-by-abortion-rights-supporters/
Education,"Kyle Rittenhouse now says he’s going to Blinn College, after Texas A&M said he’s not a student",https://www.houstonpublicmedia.org/articles/education/2022/06/06/426512/kyle-rittenhouse-now-says-hes-going-to-blinn-college-after-texas-am-said-hes-not-a-student/
Criminal Justice,Ex-Texans QB Deshaun Watson named in 24th lawsuit by massage therapists,https://www.houstonpublicmedia.org/articles/news/criminal-justice/2022/06/06/426496/ex-texans-qb-deshaun-watson-named-in-24th-lawsuit-by-massage-therapists/
Health & Science,"As the Supreme Court mulls overturning Roe. v. Wade, some Texans fear contraceptives could be at stake",https://www.houstonpublicmedia.org/articles/news/in-depth/2022/06/06/426240/texas-women-believe-their-access-to-contraceptives-may-be-at-stake/
Guns,Some Texas GOP donors urge Congress to act on gun control measures,https://www.houstonpublicmedia.org/articles/news/politics/guns/2022/06/06/426470/some-texas-gop-donors-urge-congress-to-act-on-gun-control-measures/
Health Matters,Women and Annual Checkups,https://www.houstonpublicmedia.org/articles/shows/health-matters/2022/06/06/426424/women-and-annual-checkups/
Houston Matters,"An increase in COVID levels, and Houston pet peeves (June 6, 2022)",https://www.houstonpublicmedia.org/articles/shows/houston-matters/2022/06/06/426352/an-increase-in-covid-levels-and-houston-pet-peeves-june-6-2022/
Town Square,Questions about caring for your pets? Ask a vet!,https://www.houstonpublicmedia.org/articles/shows/town-square/2022/06/03/426436/questions-about-caring-for-your-pets-ask-a-vet/
I SEE U,"I SEE U, Episode 3: The Tulsa Opera[tion] [Encore]",https://www.houstonpublicmedia.org/articles/shows/i-see-u/2022/06/03/426312/i-see-u-episode-3-the-tulsa-operation-encore/
Guns,18-year-olds can buy an AR-15-style rifle in Texas. Now some Uvalde residents want the legal age raised,https://www.houstonpublicmedia.org/articles/news/politics/guns/2022/06/03/426402/18-year-olds-can-buy-an-ar-15-style-rifle-in-texas-now-some-uvalde-residents-want-the-legal-age-raised/
Texas,4 Tomball ISD students & family member killed by Texas prison escapee on the run for weeks,https://www.houstonpublicmedia.org/articles/news/texas/2022/06/03/426393/police-fatally-shoot-texas-escapee-who-killed-5-while-on-the-run-for-weeks/
