section,title,url
Police,"Houston-area police officer Robin Williams, who’s running for mayor, accused of assaulting boyfriend with baton, taser",https://www.houstonpublicmedia.org/articles/police/2023/01/11/441103/missouri-city-officer-houston-mayor-candidate-robin-williams-assaulting-boyfriend-accusations/
Arts & Culture,The changing face of Chinatown: could the new trendy restaurants replace the beloved institutions?,https://www.houstonpublicmedia.org/articles/arts-culture/2023/01/11/440954/440954/
Transportation,"Houston Hobby, Bush Intercontinental flights delayed as air travel across US in chaos after computer outage",https://www.houstonpublicmedia.org/articles/news/transportation/2023/01/11/441078/houston-hobby-bush-intercontinental-flights-delayed-as-air-travel-across-us-in-chaos-after-computer-outage/
Transportation,How Houston will continue expanding transportation options in 2023,https://www.houstonpublicmedia.org/articles/news/transportation/2023/01/11/441040/houston-expanding-transportation-options-2023/
Criminal Justice,Texas executes Robert Fratta after high courts reject challenges to expired lethal injection drugs,https://www.houstonpublicmedia.org/articles/news/criminal-justice/2023/01/11/441061/texas-executes-robert-fratta-after-high-courts-reject-challenges-to-expired-lethal-injection-drugs/
Energy & Environment,Harris County adopts plan to slash greenhouse gas emissions on county operations 40% by 2030,https://www.houstonpublicmedia.org/articles/news/energy-environment/2023/01/10/440973/harris-county-adopts-plan-to-slash-greenhouse-gas-emissions-on-county-operations-40-by-2030/
Houston,Grand jury to determine whether to bring charges against Houston taqueria customer who shot attempted robber,https://www.houstonpublicmedia.org/articles/news/houston/2023/01/10/440914/grand-jury-to-determine-whether-to-bring-charges-against-houston-taqueria-customer-who-shot-attempted-robber/
Energy & Environment,Consumers in Houston and across Texas may experience sticker shock after opening their gas bills this month,https://www.houstonpublicmedia.org/articles/news/energy-environment/2023/01/10/440912/consumers-in-houston-and-across-texas-may-experience-sticker-shock-after-opening-their-gas-bills-this-month/
Houston Matters,The Full Menu: Best new Houston restaruants,https://www.houstonpublicmedia.org/articles/shows/houston-matters/2023/01/11/440902/the-full-menu-best-new-houston-restaruants/
Transportation,All departing US flights grounded after FAA computer outage,https://www.houstonpublicmedia.org/articles/news/transportation/2023/01/11/441033/all-departing-us-flights-grounded-after-faa-computer-outage/
Houston Matters,"Houston traffic congestion (Jan. 11, 2023)",https://www.houstonpublicmedia.org/articles/shows/houston-matters/2023/01/11/440635/houston-traffic-congestion-jan-11-2023/
Town Square,"Ask the Doctor: The Latest on the New COVID Variant XBB.1.5, Long COVID, Flu and RSV",https://www.houstonpublicmedia.org/articles/shows/town-square/2023/01/10/440979/ask-the-doctor-the-latest-on-the-new-covid-variant-xbb-1-5-long-covid-flu-and-rsv/
Politics,Texas’ 88th Legislature kicks off; Republican Dade Phelan reelected as House speaker,https://www.houstonpublicmedia.org/articles/news/politics/2023/01/10/440968/texas-88th-legislature-kicks-off-republican-dade-phelan-reelected-as-house-speaker/
Education,Texas universities propose two-year tuition freeze in exchange for nearly $1 billion in additional state funding,https://www.houstonpublicmedia.org/articles/education/2023/01/10/440960/texas-universities-propose-two-year-tuition-freeze-in-exchange-for-nearly-1-billion-in-additional-state-funding/
Arts & Culture,Only one Hindu temple outside India is dedicated to the goddess of marriage. Why’s it in Pearland?,https://www.houstonpublicmedia.org/articles/arts-culture/2023/01/10/440905/only-one-hindu-temple-outside-india-is-dedicated-to-the-goddess-of-marriage-whys-it-in-pearland/
Education,Houston Community College reveals first two bachelor’s degree programs,https://www.houstonpublicmedia.org/articles/education/2023/01/10/440878/houston-community-college-reveals-first-two-bachelors-degree-programs/
Politics,Texas’ record-breaking surplus is now nearly $33 billion,https://www.houstonpublicmedia.org/articles/news/politics/2023/01/10/440894/texas-record-breaking-surplus-is-now-nearly-33-billion/
Traffic,County commissioner offers to amend Third Ward bike-lane project if Houston officials contribute millions more,https://www.houstonpublicmedia.org/articles/news/traffic/2023/01/10/440884/county-commissioner-rodney-ellis-offers-to-amend-third-ward-bike-lane-project-if-houston-officials-contribute-millions-more-in-money/
Politics,Texas has an unprecedented budget surplus. What can be done with the billions of dollars?,https://www.houstonpublicmedia.org/articles/news/politics/2023/01/10/440769/texas-has-an-unprecedented-budget-surplus-what-can-be-done-with-the-billions-of-dollars/
Houston Matters,"The latest COVID subvariant’s effect on Houston (Jan. 10, 2023)",https://www.houstonpublicmedia.org/articles/shows/houston-matters/2023/01/10/440633/latest-covid-subvariants-effect-on-houston-jan-10-2023/
Town Square,Celebrating Law Enforcement Appreciation Day,https://www.houstonpublicmedia.org/articles/shows/town-square/2023/01/09/440882/celebrating-law-enforcement-appreciation-day/
Criminal Justice,Ex-Missouri City officer Robert Fratta to be executed Tuesday in murder-for-hire plot,https://www.houstonpublicmedia.org/articles/news/criminal-justice/2023/01/09/440848/ex-missouri-city-officer-robert-fratta-to-be-executed-tuesday-in-murder-for-hire-plot/
Immigration,Joe Biden tours El Paso for first border visit of his presidency,https://www.houstonpublicmedia.org/articles/news/politics/immigration/2023/01/09/440842/joe-biden-tours-el-paso-for-first-border-visit-of-his-presidency/
Houston,Grand jury dismisses charges against Houston Astros fan accused of throwing beer cans at Sen. Ted Cruz,https://www.houstonpublicmedia.org/articles/news/houston/2023/01/09/440837/grand-jury-dismisses-charges-against-houston-astros-fan-accused-of-throwing-beer-cans-at-sen-ted-cruz/
Coronavirus,"COVID-19 numbers increase in Houston region as vaccine immunity wanes, fatigue in precautions",https://www.houstonpublicmedia.org/articles/news/health-science/coronavirus/2023/01/09/440827/covid-19-numbers-increase-in-houston-region-as-vaccine-immunity-wanes-fatigue-in-precautions/
Energy & Environment,Researchers test private wells near Jones Road Superfund Site after EPA report finds groundwater contamination is still a concern,https://www.houstonpublicmedia.org/articles/news/energy-environment/2023/01/09/440766/researchers-test-private-wells-near-jones-road-superfund-site-after-epa-report-finds-groundwater-contamination-is-still-a-concern/
Local,Houston police: Customer who killed attempted taqueria robber could be willing to meet with investigators,https://www.houstonpublicmedia.org/articles/news/local/2023/01/09/440822/houston-police-customer-who-killed-attempted-taqueria-robber-could-be-willing-to-meet-with-investigators/
Sports,Houston Texans fire coach Lovie Smith after just one season,https://www.houstonpublicmedia.org/articles/news/sports/2023/01/09/440807/houston-texans-fire-coach-lovie-smith-after-just-one-season/
Houston,Memorial Park sets Feb. 11 as new date for land bridge grand opening,https://www.houstonpublicmedia.org/articles/news/houston/2023/01/09/440753/memorial-park-sets-feb-11-as-new-date-for-land-bridge-grand-opening/
Houston Matters,"Texas Legislature preview (Jan. 9, 2023)",https://www.houstonpublicmedia.org/articles/shows/houston-matters/2023/01/09/440631/texas-legislature-preview-jan-9-2023/
Town Square,"The January 6th Report: What We’ve Learned & What Are the Next Steps; Plus, the Latest in Politics with the Co-Hosts of Party Politics",https://www.houstonpublicmedia.org/articles/shows/town-square/2023/01/06/440757/the-january-6th-report-what-weve-learned-plus-the-latest-in-politics-with-the-co-hosts-of-party-politics/
Criminal Justice,Fentanyl-related deaths in Harris County Jail spark demand for outside investigation,https://www.houstonpublicmedia.org/articles/news/criminal-justice/2023/01/06/440645/fentanyl-related-deaths-in-harris-county-jail-spark-demand-for-outside-investigation/
