section,title,url
Elections,Houston councilwoman involved in polling location dispute denies electioneering claims,https://www.houstonpublicmedia.org/articles/news/politics/elections/2023/12/01/471218/houston-councilwoman-involved-in-polling-location-dispute-denies-electioneering-claims/
Voting,Federal judge imposes new redistricting plan on Galveston County,https://www.houstonpublicmedia.org/articles/voting/2023/12/01/471259/federal-judge-imposes-new-redistricting-plan-on-galveston-county/
Politics,"Flyer from Houston City Council candidate Cynthia Reyes-Revilla, which attacks Mario Castillo, criticized as ‘homophobic dog whistle’",https://www.houstonpublicmedia.org/articles/news/politics/2023/12/01/471310/flyer-from-houston-city-council-candidate-cynthia-reyes-revilla-which-attacks-mario-castillo-criticized-as-homophobic-dog-whistle/
Airports,"United celebrates $2.6 billion redevelopment at Bush Airport, but Houston City Controller has yet to clear project for takeoff",https://www.houstonpublicmedia.org/articles/news/transportation/airports/2023/12/01/471300/united-celebrates-2-6-billion-redevelopment-at-bush-airport-but-houston-city-controller-has-yet-to-clear-project-for-takeoff/
News,"In honor of Beyonce’s movie premiere, local restaurants celebrating with themed brunch",https://www.houstonpublicmedia.org/articles/news/2023/12/01/471297/in-honor-of-beyonces-movie-premiere-local-restaurants-celebrating-with-themed-brunch/
Obituary,"Sandra Day O’Connor, first woman on the Supreme Court, dies",https://www.houstonpublicmedia.org/articles/obituary/2023/12/01/471231/sandra-day-oconnor-first-woman-on-the-supreme-court-dies/
Traffic,TxDOT says its strategies to reduce road congestion are working. Some experts disagree.,https://www.houstonpublicmedia.org/articles/news/traffic/2023/11/30/471195/txdot-says-its-strategies-to-reduce-road-congestion-are-working-some-experts-disagree/
Energy & Environment,"Houston’s communities of color are hit hardest by worsening air quality, new report says",https://www.houstonpublicmedia.org/articles/news/energy-environment/2023/11/30/471066/houstons-communities-of-color-are-hit-hardest-by-worsening-air-quality-new-report-says/
City of Houston,Houston Public Works investigating employee wrongdoing allegations,https://www.houstonpublicmedia.org/articles/news/city-of-houston/2023/12/01/471301/two-houston-public-works-employees-out-of-jobs-investigation-continues-for-emergency-water-contracts/
Encore Houston,Episode 203: Apollo Chamber Players,https://www.houstonpublicmedia.org/articles/shows/encore-houston/2023/12/01/471254/episode-203-apollo-chamber-players/
Events,"RodeoHouston 2024 to feature EDM, country and rap artists",https://www.houstonpublicmedia.org/articles/events/2023/12/01/471249/rodeo-houston-edm-country-and-rap-artists-will-take-the-rodeo-stage-next-year-guess-the-lineup/
Health & Science,"Texas attorney general sues Pfizer, claiming vaccines didn’t end pandemic quickly enough",https://www.houstonpublicmedia.org/articles/news/health-science/2023/12/01/471244/texas-attorney-general-sues-pfizer-claiming-vaccines-didnt-end-pandemic-quickly-enough/
I SEE U,"I SEE U, Episode 81: A Mistranslation of Biblical Proportions with Documentarian Sharon “Rocky” Roggio [Encore]",https://www.houstonpublicmedia.org/articles/shows/i-see-u/2023/12/01/470858/i-see-u-episode-81-a-mistranslation-of-biblical-proportions-with-documentarian-sharon-rocky-roggio-encore/
Education,Texas teachers are struggling financially. The school voucher war killed a salary raise.,https://www.houstonpublicmedia.org/articles/education/2023/12/01/471226/texas-teachers-are-struggling-financially-the-school-voucher-war-killed-a-salary-raise/
Border,"Children may be harmed the most by Texas’ illegal entry bill, advocates warn",https://www.houstonpublicmedia.org/articles/news/border/2023/12/01/471222/children-may-be-harmed-the-most-by-texas-illegal-entry-bill-advocates-warn/
Houston Matters,"The Houston commute (Dec. 1, 2023)",https://www.houstonpublicmedia.org/articles/shows/houston-matters/2023/12/01/470614/the-houston-commute-dec-1-2023/
Party Politics,Who will win the Houston mayor’s race?,https://www.houstonpublicmedia.org/articles/shows/party-politics/2023/12/01/471213/who-will-win-the-houston-mayors-race/
Houston Matters,"Rice relocates statue and remains of slave-owning founder: The Good, Bad, and Ugly of the week",https://www.houstonpublicmedia.org/articles/shows/houston-matters/2023/12/01/470616/rice-relocates-statue-and-remains-of-slave-owning-founder-the-good-bad-and-ugly-of-the-week/
Energy & Environment,"EPA awards another $500,000 grant for air-quality monitoring in Houston neighborhoods",https://www.houstonpublicmedia.org/articles/news/energy-environment/2023/11/30/471206/epa-awards-another-500000-grant-for-air-quality-monitoring-in-houston-neighborhoods/
Voting,U.S. 5th Circuit orders Galveston County to redraw its political map,https://www.houstonpublicmedia.org/articles/voting/2023/11/30/471194/u-s-5th-circuit-orders-galveston-county-to-redraw-its-political-map/
Crime,Spring Branch ISD police officer fatally shoots man suspected of killing his father before stealing cars outside elementary school,https://www.houstonpublicmedia.org/articles/news/crime/2023/11/30/471185/spring-branch-isd-police-officer-fatally-shoots-man-suspecting-of-killing-his-father-before-stealing-cars-outside-nearby-elementary-school/
Houston Matters,A 300-ton pile of oyster shells and a unique plan to restore reefs along Galveston Bay,https://www.houstonpublicmedia.org/articles/shows/houston-matters/2023/11/30/471140/a-300-ton-pile-of-oyster-shells-and-a-unique-plan-to-restore-reefs-along-galveston-bay/
Transportation,"City of Houston to expand ride-share program in Third Ward to Second Ward, other neighborhoods",https://www.houstonpublicmedia.org/articles/news/transportation/2023/11/30/471178/houston-expanding-free-ride-share-service-two-shuttles-heading-to-second-ward/
Houston Matters,"When schools obtain the ‘district of innovation’ status, do they actually innovate?",https://www.houstonpublicmedia.org/articles/shows/houston-matters/2023/11/30/471100/do-districts-of-innovation-actually-innovate/
Food,Houston restaurants see boom after rave Keith Lee food reviews on Tik Tok,https://www.houstonpublicmedia.org/articles/arts-culture/food/2023/11/30/471073/keith-lee-houston-restaurants-puddery-rave-reviews/
Fort Bend,Fort Bend prosecutors receive first federal grant for drug court improvements,https://www.houstonpublicmedia.org/articles/news/fort-bend/2023/11/30/471120/fort-bend-prosecutors-receive-first-federal-grant-for-drug-court-improvements/
Houston Matters,Galveston celebrates 50 years of Dickens on the Strand,https://www.houstonpublicmedia.org/articles/shows/houston-matters/2023/11/30/471083/galveston-celebrates-50-years-of-dickens-on-the-strand/
Polls,"Majority of voters want Houston’s next mayor to focus on mental health, poll finds",https://www.houstonpublicmedia.org/articles/news/polls/2023/11/30/471085/majority-of-voters-want-houstons-next-mayor-to-focus-on-mental-health-poll-finds/
Texas,"Climate change, costly disasters sent Texas homeowner insurance rates skyrocketing this year",https://www.houstonpublicmedia.org/articles/news/texas/2023/11/30/471063/climate-change-costly-disasters-sent-texas-homeowner-insurance-rates-skyrocketing-this-year/
Health & Science,Ransomware attack prompts multistate hospital chain to divert some ER patients elsewhere,https://www.houstonpublicmedia.org/articles/news/health-science/2023/11/30/471059/ransomware-attack-prompts-multistate-hospital-chain-to-divert-some-er-patients-elsewhere/
Weather,"Hail, tornadoes a potential in Houston-area storms Thursday",https://www.houstonpublicmedia.org/articles/news/weather/2023/11/30/471054/hail-tornadoes-a-potential-in-houston-area-storms-thursday/
Houston Matters,"Severe weather in Houston (Nov. 30, 2023)",https://www.houstonpublicmedia.org/articles/shows/houston-matters/2023/11/30/470611/severe-weather-in-houston-nov-30-2023/
