section,title,url
Police,"Hundreds of celebratory gunfire calls received on New Year’s Eve in Houston, police say",https://www.houstonpublicmedia.org/articles/police/2024/01/02/473302/hundreds-of-celebratory-gunfire-calls-received-on-new-years-eve-in-houston-police-say/
Houston Mayor,"Mayor John Whitmire takes the reins, focusing on public safety, infrastructure, and city services",https://www.houstonpublicmedia.org/articles/news/houston-mayor/2024/01/02/473061/mayor-john-whitmire-takes-the-reins-focusing-on-public-safety-infrastructure-and-city-services/
Sports,College Football Playoff National Championship features high-flying Washington against stout Michigan,https://www.houstonpublicmedia.org/articles/news/sports/2024/01/02/473251/college-football-playoff-national-championship-washington-michigan-nrg-stadium-houston/
Health & Science,"Most Texans can’t find or afford mental health care, according to new report",https://www.houstonpublicmedia.org/articles/news/health-science/2024/01/02/473294/most-texans-cant-find-or-afford-mental-health-care-according-to-new-report/
Houston Mayor,Houston’s newest elected officials to be sworn into office during public inauguration ceremony Tuesday,https://www.houstonpublicmedia.org/articles/news/houston-mayor/2024/01/02/473229/houstons-newest-elected-officials-to-be-sworn-into-office-during-public-inauguration-ceremony-tuesday/
Education,Houston nonprofit helps high school students get paid internships,https://www.houstonpublicmedia.org/articles/education/2024/01/02/473180/houston-nonprofit-helpign-high-school-students-get-paid-internships/
Houston,"Emma, Liam continue reigns as Houston’s most popular baby names in 2023",https://www.houstonpublicmedia.org/articles/news/houston/2024/01/02/473256/most-popular-baby-names-houston-2023/
Texas,"Vouchers, border security, abortion: The issues you heard about in 2023 will continue to be hotly debated",https://www.houstonpublicmedia.org/articles/news/texas/2024/01/02/473236/vouchers-border-security-abortion-the-issues-you-heard-about-in-2023-will-continue-to-be-hotly-debated/
Sports,"Houston to keep Roughnecks football team after XFL, USFL merger",https://www.houstonpublicmedia.org/articles/news/sports/2024/01/02/473331/houston-roughnecks-xfl-usfl-merger-united-football-league/
Houston Matters,How NASA plans to safely crash the ISS into the Pacific Ocean,https://www.houstonpublicmedia.org/articles/shows/houston-matters/2024/01/02/473322/how-nasa-plans-to-safely-crash-the-iss-into-the-pacific-ocean/
Texas,U.S. Department of Justice says it’ll sue if Texas enforces new law punishing illegal border crossing,https://www.houstonpublicmedia.org/articles/news/texas/2024/01/02/473287/u-s-department-of-justice-says-itll-sue-if-texas-enforces-new-law-punishing-illegal-border-crossing/
Houston Matters,Why it takes two actors to portray Tina Turner in the musical about her life,https://www.houstonpublicmedia.org/articles/shows/houston-matters/2024/01/02/473264/why-it-takes-two-actors-to-portray-tina-turner-in-the-musical-about-her-life/
Briefcase,Bill of Rights: Progressive Era Amendments,https://www.houstonpublicmedia.org/articles/shows/briefcase/2024/01/02/473276/bill-of-rights-progressive-era-amendments/
Houston Matters,"Harris County’s income assistance program (Jan. 2, 2024)",https://www.houstonpublicmedia.org/articles/shows/houston-matters/2024/01/02/472305/harris-countys-income-assistance-program-jan-2-2024/
Health & Science,Winter blues or something more? Psychiatrist says less sunlight in the winter can affect mood,https://www.houstonpublicmedia.org/articles/news/health-science/2024/01/01/473162/winter-blues-or-something-more-psychiatrist-says-less-sunlight-in-the-winter-can-affect-mood/
Health & Science,"Texas has ‘alarmingly’ high maternal, infant mortality rates, study shows",https://www.houstonpublicmedia.org/articles/news/health-science/2024/01/01/473196/texas-has-alarmingly-high-maternal-infant-mortality-rates-study-shows/
Animals,Officials advise Houston pet owners to take responsibility as the weather gets colder or face legal consequences,https://www.houstonpublicmedia.org/articles/news/energy-environment/animals/2023/12/29/473088/officials-advise-houston-pet-owners-to-take-responsibility-as-the-weather-gets-colder-or-face-legal-consequences/
I SEE U,"I SEE U, Episode 101: Sylvester Turner: Mayor of Heaven, Hell and Houston [Encore]",https://www.houstonpublicmedia.org/articles/shows/i-see-u/2023/12/29/472789/i-see-u-episode-101-sylvester-turner-mayor-of-heaven-hell-and-houston-encore/
Fort Bend,Missouri City recreation programs aim to make fitness classes accessible for disabled residents,https://www.houstonpublicmedia.org/articles/news/fort-bend/2023/12/29/473030/missouri-city-recreation-programs-aim-to-make-fitness-classes-accessible-for-disabled-residents/
News,Spring named most generous city by GoFundMe,https://www.houstonpublicmedia.org/articles/news/2023/12/28/473033/spring-gofundme-most-generous-city-2023/
Education,"Amid a lack of state funding, challenges lie ahead for Houston-area school districts in multi-million dollar budget deficits",https://www.houstonpublicmedia.org/articles/education/2023/12/28/473125/amid-a-lack-of-state-funding-challenges-lie-ahead-for-houston-area-school-districts-in-multi-million-dollar-budget-deficits/
Arts & Culture,2024 New Year’s Eve celebrations in Houston,https://www.houstonpublicmedia.org/articles/arts-culture/2023/12/27/472963/2024-new-years-eve-celebrations-in-houston/
Sports,"College Football Playoff: Houston host committee excited about prospects for championship game, especially if Texas Longhorns make it",https://www.houstonpublicmedia.org/articles/news/sports/2023/12/27/472538/college-football-playoff-houston-host-committee-excited-about-prospects-for-championship-game-especially-if-texas-longhorns-make-it/
HISD,"Homeless Houston ISD student removed from school after absences, mother arrested due to alleged ‘terroristic threat’",https://www.houstonpublicmedia.org/articles/news/education-news/hisd/2023/12/26/473113/homeless-houston-isd-student-removed-from-school-after-absences-mother-arrested-due-to-alleged-terroristic-threat/
Economy,Job hunters can get help from top outplacement firm today and tomorrow,https://www.houstonpublicmedia.org/articles/economy/2023/12/26/472012/job-hunters-can-get-help-from-top-outplacement-firm-today-and-tomorrow/
Health Matters,The Importance of Getting a Health Checkup in the New Year,https://www.houstonpublicmedia.org/articles/shows/health-matters/2023/12/25/473100/the-importance-of-getting-a-health-checkup-in-the-new-year/
Houston Matters,Holiday lights are on full display in Houston,https://www.houstonpublicmedia.org/articles/shows/houston-matters/2023/12/22/473146/holiday-lights-are-on-full-display-in-houston/
Business,"Texas employment rate growing faster than the rest of the nation, state commission data shows",https://www.houstonpublicmedia.org/articles/news/business/2023/12/22/473173/texas-employment-rate-growing-faster-than-the-rest-of-the-nation-state-commission-date-shows/
Infrastructure,Houston awarded $10 million grant to improve pedestrian safety on four streets,https://www.houstonpublicmedia.org/articles/infrastructure/2023/12/22/473163/houston-awarded-10-m-grant-to-improve-pedestrian-safety-on-four-streets/
Education,Houston ISD teacher absenteeism down by 43 percent this year,https://www.houstonpublicmedia.org/articles/education/2023/12/22/473147/houston-isd-teacher-absenteeism-down-by-43-percent-this-year/
Encore Houston,Episode 207: Houston Brass Quintet,https://www.houstonpublicmedia.org/articles/shows/encore-houston/2023/12/22/473034/episode-207-houston-brass-quintet/
Immigration,Texas begins flying migrants from southern border to Chicago,https://www.houstonpublicmedia.org/articles/news/politics/immigration/2023/12/22/473081/texas-begins-flying-migrants-from-southern-border-to-chicago/
