section,title,url
Houston,"Houston Turkey Trot ending after 30 years, BakerRipley announces",https://www.houstonpublicmedia.org/articles/news/houston/2023/10/03/465544/houston-turkey-trot-ending-after-30-years-bakerripley-announces/
HISD,Exclusive: Houston ISD struggles with special education services after cutting workers,https://www.houstonpublicmedia.org/articles/news/education-news/hisd/2023/10/03/465488/exclusive-houston-isd-struggles-with-special-education-services-after-cutting-workers/
Supreme Court,Payday lenders’ Texas lawsuit could topple watchdog that regulates them,https://www.houstonpublicmedia.org/articles/court/supreme-court/2023/10/03/465516/payday-lenders-texas-lawsuit-could-topple-watchdog-that-regulates-them/
Houston Matters,When is an elected leader too old to serve? Surprise — the answer depends on your politics,https://www.houstonpublicmedia.org/articles/shows/houston-matters/2023/10/03/465525/when-is-an-elected-leader-too-old-to-serve-surprise-the-answer-depends-on-your-politics/
Books & Libraries,Banned book mobile to stop in Houston Saturday,https://www.houstonpublicmedia.org/articles/education/books-libraries/2023/10/03/465508/banned-book-mobile-to-stop-in-houston-saturday/
Events,Houston pumpkin patches list: Where to find the best fall fun this October,https://www.houstonpublicmedia.org/articles/events/2023/10/02/465475/houston-pumpkin-patches-halloween-where-to-find-the-best-fall-fun-this-october/
News,"More Houston residents are in support of additional funding for parks, survey shows",https://www.houstonpublicmedia.org/articles/news/2023/10/02/465472/465472/
Books & Libraries,Harris County Public Library marks Banned Book Week with new “book sanctuary” status,https://www.houstonpublicmedia.org/articles/education/books-libraries/2023/10/02/465464/harris-county-public-library-marks-banned-book-week-with-new-book-sanctuary-status/
Health & Science,"Whistleblowers beg leaders to ‘stop the chaos’ as more than 900,000 Texans are kicked off Medicaid",https://www.houstonpublicmedia.org/articles/news/health-science/2023/10/03/465500/whistleblowers-beg-leaders-to-stop-the-chaos-as-more-than-900000-texans-are-kicked-off-medicaid/
Houston Matters,"Politicians and age (Oct. 3, 2023)",https://www.houstonpublicmedia.org/articles/shows/houston-matters/2023/10/03/465193/candidate-interview-sheila-jackson-lee-oct-3-2023/
Houston,"Over 4,500 people have signed a petition to preserve old live oak trees along Montrose Boulevard",https://www.houstonpublicmedia.org/articles/news/houston/2023/10/02/465483/over-4500-people-have-signed-a-petition-to-preserve-old-live-oak-trees-along-montrose-boulevard/
Sports,Houston had a good weekend in sports. Local expert discusses what’s next for the Astros,https://www.houstonpublicmedia.org/articles/news/sports/2023/10/02/465420/houston-had-a-good-weekend-in-sports-local-expert-discusses-whats-next-for-the-astros/
Criminal Justice,Katy man pleads guilty to assault on federal officer during Jan. 6 insurrection,https://www.houstonpublicmedia.org/articles/news/criminal-justice/2023/10/02/465410/katy-man-pleads-guilty-to-assault-on-federal-officer-during-jan-6-insurrection/
Law Enforcement,Law enforcement throughout Harris County prepping for annual National Night Out,https://www.houstonpublicmedia.org/articles/law-enforcement/2023/10/02/465438/national-night-out-houston-harris-county-2023/
Energy & Environment,TCEQ to hear public comment over asphalt plant’s operations in Houston’s East End,https://www.houstonpublicmedia.org/articles/news/energy-environment/2023/10/02/465362/tceq-set-to-hear-public-comment-tonight-over-asphalt-plants-operations-in-houstons-east-end/
Sports,"Space City Home Network, which will broadcast Astros and Rockets games, set for launch",https://www.houstonpublicmedia.org/articles/news/sports/2023/10/02/465402/space-city-home-network-which-will-broadcast-astros-and-rockets-games-set-for-launch/
News,"Beyoncé brings the Renaissance World Tour to movie theaters in December, tickets now on sale",https://www.houstonpublicmedia.org/articles/news/2023/10/02/465392/beyonce-brings-the-renaissance-world-tour-to-movie-theaters-in-december-tickets-now-on-sale/
Houston Matters,Houstonians have had it with technology…AND traffic (of course),https://www.houstonpublicmedia.org/articles/shows/houston-matters/2023/10/02/465406/houstonians-have-had-it-with-technology-and-traffic-of-course/
Houston Matters,Just because there was no shutdown doesn’t mean Houston wasn’t affected,https://www.houstonpublicmedia.org/articles/shows/houston-matters/2023/10/02/465396/just-because-there-was-no-shutdown-doesnt-mean-houston-wasnt-affected/
Sports,Astros beat Diamondbacks 8-1 to earn third straight AL West title,https://www.houstonpublicmedia.org/articles/news/sports/2023/10/02/465370/astros-beat-diamondbacks-8-1-to-earn-third-straight-al-west-title/
Politics,Houston-area development has become a right-wing lightning rod on immigration,https://www.houstonpublicmedia.org/articles/news/politics/2023/10/02/465350/houston-area-development-has-become-a-right-wing-lightning-rod-on-immigration/
Education,Special session at Texas Capitol on school vouchers to start Oct. 9,https://www.houstonpublicmedia.org/articles/education/2023/10/02/465346/special-session-at-texas-capitol-on-school-vouchers-to-start-oct-9/
Politics,Lawsuit seeking Lina Hidalgo’s removal from office filed days before her return,https://www.houstonpublicmedia.org/articles/news/politics/2023/10/02/465341/lawsuit-seeks-to-remove-harris-county-judge-linda-hidalgo-from-office-days-before-return/
Houston Matters,"Shutdown avoided (Oct. 2, 2023)",https://www.houstonpublicmedia.org/articles/shows/houston-matters/2023/10/02/465191/shutdown-avoided-oct-2-2023/
Elections,"The race for Houston city controller is likely to hinge on name recognition, partisanship",https://www.houstonpublicmedia.org/articles/news/politics/elections/2023/10/02/464065/the-race-for-houston-city-controller-is-likely-to-hinge-on-name-recognition-partisanship/
Education News,"Humble ISD could scrap plan for free Memorial Hermann clinic over concerns about ‘family planning’ services, gender-affirming care",https://www.houstonpublicmedia.org/articles/news/education-news/2023/09/29/465326/humble-isd-could-scrap-plan-for-free-memorial-hermann-clinic-over-concerns-about-family-planning-services-gender-affirming-care/
Weather,Summer 2023 was officially Houston’s hottest on record,https://www.houstonpublicmedia.org/articles/news/weather/2023/09/29/465325/houston-hottest-summer-ever-2023/
I SEE U,"I SEE U, Episode 97: A Million Ways To DEI with Esteemed Professor Kathleen McElroy",https://www.houstonpublicmedia.org/articles/shows/i-see-u/2023/09/29/465206/i-see-u-episode-97-a-million-ways-to-dei-with-esteemed-professor-kathleen-mcelroy/
Politics,4 Texas Republicans join ultraconservatives to sink GOP attempt to keep federal government open,https://www.houstonpublicmedia.org/articles/news/politics/2023/09/29/465323/4-texas-republicans-join-ultraconservatives-to-sink-gop-attempt-to-keep-federal-government-open/
Energy & Environment,EPA to move forward with next steps on cleaning up San Jacinto river’s waste pits,https://www.houstonpublicmedia.org/articles/news/energy-environment/2023/09/29/465319/epa-to-take-over-cleaning-up-san-jacinto-rivers-waste-pits/
Local,League City to name future roadway in honor of one of its first Black descendants,https://www.houstonpublicmedia.org/articles/news/local/2023/09/29/465299/league-city-to-name-future-roadway-in-honor-of-one-of-its-first-black-descendants/
Criminal Justice,Felony cases are being audited at the Galveston County DA’s Office after a prosecutor was fired for allegedly withholding evidence,https://www.houstonpublicmedia.org/articles/news/criminal-justice/2023/09/29/465221/felony-cases-are-being-audited-at-the-galveston-county-das-office-after-a-prosecutor-was-fired-for-allegedly-withholding-evidence/
