section,title,url
HISD,Ex-Houston ISD superintendent Millard House II lands similar job in Washington D.C. area,https://www.houstonpublicmedia.org/articles/news/education-news/hisd/2023/06/07/453904/millard-house-prince-george-county-superintendent-after-houston-isd/
Airports,Woman arrested on runway in latest security breach at Houston’s Bush Intercontinental Airport,https://www.houstonpublicmedia.org/articles/news/transportation/airports/2023/06/07/453833/houston-bush-intercontinental-woman-arrested-on-runway-in-latest-security-breach/
Food,Bun B’s Trill Burgers launches first brick-and-mortar location in Houston,https://www.houstonpublicmedia.org/articles/arts-culture/food/2023/06/07/453856/bun-bs-trill-burgers-launches-first-brick-and-mortar-location-in-houston/
Criminal Justice,"Four Houston bars, husband of alleged drunk driver added as defendants in $1 million wrongful death lawsuit",https://www.houstonpublicmedia.org/articles/news/criminal-justice/2023/06/07/453792/four-houston-bars-husband-of-alleged-drunk-driver-added-as-defendants-in-1-million-wrongful-death-lawsuit/
Houston,Houston Police warn residents to be aware of increased jugging incidents,https://www.houstonpublicmedia.org/articles/news/houston/2023/06/07/453882/houston-police-warn-residents-to-be-aware-of-increased-jugging-incidents/
Police,Katy ISD conducts mock mass shooter response drill to increase school security,https://www.houstonpublicmedia.org/articles/police/2023/06/07/453888/katy-isd-conducts-mock-mass-shooter-response-drill-to-increase-school-security/
Harris County,Harris County Commissioners Court creates body to help LGBTQ community,https://www.houstonpublicmedia.org/articles/news/harris-county/2023/06/07/453878/harris-county-commissioners-court-creates-body-to-help-lgbtq-community/
Politics,"After a week’s delay, Lt. Gov. Dan Patrick signs bill to increase transparency in public records law",https://www.houstonpublicmedia.org/articles/news/politics/2023/06/07/453861/after-a-weeks-delay-lt-gov-dan-patrick-signs-bill-to-increase-transparency-in-public-records-law/
Houston Matters,"The first woman headed to the moon (June 8, 2023)",https://www.houstonpublicmedia.org/articles/shows/houston-matters/2023/06/08/453424/the-first-woman-headed-to-the-moon-june-8-2023/
Town Square,Lidia Bastianich on Her New PBS Special “Lidia Celebrates America: Flavors That Define Us”,https://www.houstonpublicmedia.org/articles/shows/town-square/2023/06/07/453926/lidia-bastianich-on-her-new-pbs-special-lidia-celebrates-america-flavors-that-define-us/
Energy & Environment,"Shell’s clean energy advertising campaign is misleading, UK watchdog says",https://www.houstonpublicmedia.org/articles/news/energy-environment/2023/06/07/453857/shells-clean-energy-advertising-campaign-is-misleading-uk-watchdog-says/
Houston Matters,The Full Menu: Houston’s best new restaurants of 2023 (so far),https://www.houstonpublicmedia.org/articles/shows/houston-matters/2023/06/07/453573/the-full-menu-houstons-best-new-restaurants-of-2023-so-far/
Houston Matters,Political roundup: Presidential field grows while property tax relief stalls,https://www.houstonpublicmedia.org/articles/shows/houston-matters/2023/06/07/453821/the-presidential-field-grows-while-property-tax-relief-stalls-political-roundup-for-wednesday-june-7-2023/
Houston Matters,How Houston’s DJ Sun reimagined his music for a 25-piece orchestra,https://www.houstonpublicmedia.org/articles/shows/houston-matters/2023/06/07/453799/how-houstons-dj-sun-reimagined-his-music-for-a-25-piece-orchestra/
Houston Matters,"The week in politics (June 7, 2023)",https://www.houstonpublicmedia.org/articles/shows/houston-matters/2023/06/07/453422/the-week-in-politics-june-7-2023/
Town Square,The Latest on the DACA Hearings and Immigration in the U.S.,https://www.houstonpublicmedia.org/articles/shows/town-square/2023/06/06/453781/the-latest-on-the-daca-hearings-and-immigration-in-the-u-s/
Houston,Potential Columbia Tap Trail cyclist attacks suspects identified by Houston police,https://www.houstonpublicmedia.org/articles/news/houston/2023/06/06/453794/columbia-tap-trail-suspects-identified-in-houston-cyclist-attacks/
City of Houston,"City of Houston, DOJ reach settlement on alleged illegal dumping discrimination",https://www.houstonpublicmedia.org/articles/news/city-of-houston/2023/06/06/453787/city-of-houston-and-doj-reach-settlement-on-alleged-illegal-dumping-discrimination/
Education News,"University of Houston to install balcony screens, re-open Agnes Arnold Hall in fall after two student suicides",https://www.houstonpublicmedia.org/articles/news/education-news/2023/06/06/453774/university-of-houston-balcony-screens-agnes-arnold-hall-two-student-suicides-2023-reopening-fall/
Local,School districts throughout Houston area have begun summer meal programs,https://www.houstonpublicmedia.org/articles/news/local/2023/06/06/453744/houston-school-summer-meal-programs-2023/
Houston Matters,"Five years after the Santa Fe High School shooting, why has there been no trial?",https://www.houstonpublicmedia.org/articles/shows/houston-matters/2023/06/06/453732/five-years-after-the-santa-fe-high-school-shooting-why-has-there-been-no-trial/
Gun control,"Texas lawmakers closed a background check loophole, but many gun measures failed to pass",https://www.houstonpublicmedia.org/articles/news/politics/gun-control/2023/06/06/453733/texas-lawmakers-closed-a-background-check-loophole-but-many-gun-measures-failed-to-pass/
Houston Matters,Saudi Arabia plans to cut oil production again – what does it mean for Houstonians?,https://www.houstonpublicmedia.org/articles/shows/houston-matters/2023/06/06/453720/saudi-arabia-plans-to-cut-oil-production-again-what-does-it-mean-for-houstonians/
Infrastructure,"How bills affecting rural Texans, including broadband & water infrastructure, fared at the Capitol",https://www.houstonpublicmedia.org/articles/infrastructure/2023/06/06/453726/how-bills-affecting-rural-texans-including-broadband-water-infrastructure-fared-at-the-capitol/
Immigration,Bexar County sheriff files criminal charges over DeSantis’ migrant flight,https://www.houstonpublicmedia.org/articles/news/politics/immigration/2023/06/06/453712/bexar-county-sheriff-files-criminal-charges-over-desantis-migrant-flight/
Houston Matters,"Oil production and gas prices (June 6, 2023)",https://www.houstonpublicmedia.org/articles/shows/houston-matters/2023/06/06/453420/oil-production-and-gas-prices-june-6-2023/
Houston Matters,Houstonians share their latest pet peeves,https://www.houstonpublicmedia.org/articles/shows/houston-matters/2023/06/05/453694/houstonians-share-their-latest-pet-peeves/
Harris County,"Harris County Commissioners pass guaranteed income program for 1,500 families",https://www.houstonpublicmedia.org/articles/news/harris-county/2023/06/05/453691/harris-county-commissioners-pass-guaranteed-income-program-for-1500-families/
Town Square,HISD Superintendent Mike Miles on his vision for improving the school district,https://www.houstonpublicmedia.org/articles/shows/town-square/2023/06/05/453660/hisd-superintendent-mike-miles-on-his-vision-for-improving-the-school-district/
Houston,"Houston leads nation in mail carrier attacks by dogs, according to USPS ranking",https://www.houstonpublicmedia.org/articles/news/houston/2023/06/05/453675/houston-dog-attacks-postal-workers-usps-ranking-number-one/
Criminal Justice,"Majority of Texas children are kept on probation despite being low risk for rearrest, new report says",https://www.houstonpublicmedia.org/articles/news/criminal-justice/2023/06/05/453522/majority-of-texas-children-are-kept-on-probation-despite-being-low-risk-for-rearrest-new-report-says/
Politics,Impeachment of Texas AG Ken Paxton exposes divisions in Collin County Republican Party,https://www.houstonpublicmedia.org/articles/news/politics/2023/06/05/453665/impeachment-of-texas-ag-ken-paxton-exposes-divisions-in-collin-county-republican-party/
