section,title,url
News,Colony Ridge developer defends Houston-area community as state leaders vow action against it,https://www.houstonpublicmedia.org/articles/news/2023/10/05/465727/colony-ridge-developer-defends-houston-area-community-as-state-leaders-vow-action-against-it/
Houston Matters,Dr. Peter Hotez sounds alarm bells about effects of ‘anti-science’ movement,https://www.houstonpublicmedia.org/articles/shows/houston-matters/2023/10/05/465753/a-houston-area-scientist-sounds-alarm-bells-about-the-effects-of-the-anti-science-movement/
schools,"Santa Fe High School cancels homecoming dance after low ticket sales, disinterest from students",https://www.houstonpublicmedia.org/articles/education/schools/2023/10/05/465780/santa-fe-high-school-cancels-homecoming-dance-after-low-ticket-sales-disinterest-from-students/
Immigration,Biden administration waives 26 federal laws to build more border wall in South Texas,https://www.houstonpublicmedia.org/articles/news/politics/immigration/2023/10/05/465722/biden-administration-waives-26-federal-laws-to-build-more-border-wall-in-south-texas/
Sports,"Twins sweep Blue Jays, will face Astros in 2023 ALDS",https://www.houstonpublicmedia.org/articles/news/sports/2023/10/05/465740/houston-astros-minnesota-twins-alds-game-times/
Houston Matters,Houston Controller candidate Dave Martin on how he would plan ahead for city’s ‘fiscal cliff’,https://www.houstonpublicmedia.org/articles/shows/houston-matters/2023/10/05/465790/houston-controller-candidate-dave-martin-on-how-he-would-plan-ahead-for-citys-fiscal-cliff/
City of Houston,City of Houston approves nearly $48 million in funding for waterline repairs,https://www.houstonpublicmedia.org/articles/news/city-of-houston/2023/10/04/465714/465714/
Elections,"Missing Houston mayoral debates unlikely to hurt John Whitmire, Sheila Jackson Lee, expert says",https://www.houstonpublicmedia.org/articles/news/politics/elections/2023/10/04/465705/missing-houston-mayors-debates-is-unlikely-to-hurt-john-whitmire-sheila-jackson-lee-expert-says/
Elections,Some Texas officials are asking voters to approve funding for a $1 billion parks fund in November,https://www.houstonpublicmedia.org/articles/news/politics/elections/2023/10/05/465825/some-texas-officials-are-asking-voters-to-approve-funding-for-a-1-billion-parks-fund-in-november/
Texas,The next execution in Texas is scheduled on World Day Against the Death Penalty,https://www.houstonpublicmedia.org/articles/news/texas/2023/10/05/465826/the-next-execution-in-texas-is-scheduled-on-world-day-against-the-death-penalty/
Houston Matters,You know who NPR’s Steve Inskeep thinks would’ve handled social media well? Abraham Lincoln,https://www.houstonpublicmedia.org/articles/shows/houston-matters/2023/10/05/465742/you-know-who-nprs-steve-inskeep-thinks-wouldve-handled-social-media-well-abraham-lincoln/
Houston Matters,"Special ed at HISD (Oct. 5, 2023)",https://www.houstonpublicmedia.org/articles/shows/houston-matters/2023/10/05/465197/special-ed-at-hisd-oct-5-2023/
Weather,Weather service issues flash flood warnings for Houston and surrounding cities Thursday morning,https://www.houstonpublicmedia.org/articles/news/weather/2023/10/05/465720/weather-service-issues-flash-flood-warnings-for-houston-and-surrounding-cities-thursday-morning/
HISD,Houston ISD’s Stevenson Middle School beefs up security after social media threat,https://www.houstonpublicmedia.org/articles/news/education-news/hisd/2023/10/04/465707/houston-isds-stevenson-middle-school-beefs-up-security-after-social-media-threat/
Houston Matters,Spacecraft built in Houston gets ready for a historic mission to the moon,https://www.houstonpublicmedia.org/articles/shows/houston-matters/2023/10/04/465663/spacecraft-built-in-houston-gets-ready-for-a-historic-mission-to-the-moon/
Health & Science,"Houston-based health insurance agency discriminates against people with HIV, complaint alleges",https://www.houstonpublicmedia.org/articles/news/health-science/2023/10/04/465656/houston-based-health-insurance-agency-discriminates-against-people-with-hiv-complaint-alleges/
Houston Matters,Actor and director Rob Reiner on the power of the screen and stage to create change,https://www.houstonpublicmedia.org/articles/shows/houston-matters/2023/10/04/465613/actor-and-director-rob-reiner-on-the-power-of-the-screen-and-stage-to-create-change/
Houston Matters,"Political Roundup: McCarthy is out, so what happens next?",https://www.houstonpublicmedia.org/articles/shows/houston-matters/2023/10/04/465621/political-roundup-mccarthy-is-out-so-what-happens-next/
Houston Matters,The Full Menu: Where to grab lunch in Houston,https://www.houstonpublicmedia.org/articles/shows/houston-matters/2023/10/04/465541/the-full-menu-where-to-grab-lunch-in-houston/
Police,Second Houston police officer relieved of duties after DWI charges,https://www.houstonpublicmedia.org/articles/police/2023/10/04/465610/second-houston-police-officer-relieved-of-duties-after-dwi-charges/
News,A nationwide emergency alert test is coming to your phone on Wednesday,https://www.houstonpublicmedia.org/articles/news/2023/10/04/465606/a-nationwide-emergency-alert-test-is-coming-to-your-phone-on-wednesday/
Politics,‘Chaos and incompetence’: Texans in Congress react to McCarthy’s removal as U.S. House Speaker,https://www.houstonpublicmedia.org/articles/news/politics/2023/10/04/465601/chaos-and-incompetence-texans-in-congress-react-to-mccarthys-removal-as-u-s-house-speaker/
Houston Matters,"Director Rob Reiner (Oct. 4, 2023)",https://www.houstonpublicmedia.org/articles/shows/houston-matters/2023/10/04/465195/director-rob-reiner-oct-4-2023/
Local,"Eternal Gandhi Museum Houston, only one in North America, hosts ribbon-cutting ceremony ",https://www.houstonpublicmedia.org/articles/news/local/2023/10/03/465588/eternal-gandhi-museum-houston-only-one-north-america-hosts-ribbon-cutting-ceremony/
Politics,"Texas Republicans stuck with Speaker Kevin McCarthy, but it wasn’t enough to save him",https://www.houstonpublicmedia.org/articles/news/politics/2023/10/03/465583/texas-republicans-stuck-with-speaker-kevin-mccarthy-but-it-wasnt-enough-to-save-him/
Fort Bend,"Fort Bend ISD unveils Sugar Land 95 memorial plans, five years after discovering unmarked graves",https://www.houstonpublicmedia.org/articles/news/fort-bend/2023/10/03/465571/fort-bend-isd-sugar-land-95-memorial-plans/
Houston,BARC warns of scam that costs owners of lost pets $250,https://www.houstonpublicmedia.org/articles/news/houston/2023/10/03/465510/barc-warns-of-scam-that-costs-owners-of-lost-pets-250/
Elections,"Leaving Houston-Galveston Area Council could cost Houston federal funds, expert warns",https://www.houstonpublicmedia.org/articles/news/politics/elections/2023/10/03/465551/leaving-houston-galveston-area-council-could-cost-houston-federal-funds-expert-warns/
Houston,"Houston Turkey Trot ending after 30 years, BakerRipley announces",https://www.houstonpublicmedia.org/articles/news/houston/2023/10/03/465544/houston-turkey-trot-ending-after-30-years-bakerripley-announces/
Houston Matters,When is an elected leader too old to serve? Surprise — the answer depends on your politics,https://www.houstonpublicmedia.org/articles/shows/houston-matters/2023/10/03/465525/when-is-an-elected-leader-too-old-to-serve-surprise-the-answer-depends-on-your-politics/
Supreme Court,Payday lenders’ Texas lawsuit could topple watchdog that regulates them,https://www.houstonpublicmedia.org/articles/court/supreme-court/2023/10/03/465516/payday-lenders-texas-lawsuit-could-topple-watchdog-that-regulates-them/
Books & Libraries,Banned book mobile to stop in Houston Saturday,https://www.houstonpublicmedia.org/articles/education/books-libraries/2023/10/03/465508/banned-book-mobile-to-stop-in-houston-saturday/
