section,title,url
Politics,Senate passes bill making illegal voting a felony again,https://www.houstonpublicmedia.org/articles/news/politics/2023/03/14/446171/senate-passes-bill-making-illegal-voting-a-felony-again/
Politics,"Senate Republicans aim to cut property taxes by a combined $16.5 billion, more than half the state’s surplus",https://www.houstonpublicmedia.org/articles/news/politics/2023/03/14/446191/senate-republicans-aim-to-cut-property-taxes-by-a-combined-16-5-billion-more-than-half-the-states-surplus/
Housing,Texas rent relief portal reopens applications for two weeks,https://www.houstonpublicmedia.org/articles/housing/2023/03/14/446184/texas-rent-relief-portal-re-opens-march-14-28-2023/
Harris County,Harris County considers spending $6 million to expand reproductive healthcare services,https://www.houstonpublicmedia.org/articles/news/harris-county/2023/03/13/446156/harris-county-considers-spending-6-million-to-expand-reproductive-healthcare-services/
Houston Matters,From the NFL to philosophy and career guidance: Earl Bennett on life after football,https://www.houstonpublicmedia.org/articles/shows/houston-matters/2023/03/14/446196/from-the-nfl-to-philosophy-and-career-guidance-earl-bennett-on-life-after-football/
Houston Matters,How public hospitals can fill in health care gaps,https://www.houstonpublicmedia.org/articles/shows/houston-matters/2023/03/14/446185/how-public-hospitals-can-fill-in-health-care-gaps/
Local,"Houston nonprofit The Alliance receives $1.5 million in federal funds to upgrade facilities, services",https://www.houstonpublicmedia.org/articles/news/local/2023/03/13/446137/houston-nonprofit-the-alliance-receives-1-5-million-in-federal-funds-to-upgrade-facilities-services/
Houston,Reward offered for camera with radioactive material last seen near a Houston Whataburger,https://www.houstonpublicmedia.org/articles/news/houston/2023/03/13/446080/missing-radioactive-camera-houston-whataburger-reward-offered/
Criminal Justice,"Texans were among the most impacted by internet crimes last year, FBI says",https://www.houstonpublicmedia.org/articles/news/criminal-justice/2023/03/14/446104/texans-were-among-the-most-impacted-by-internet-crimes-last-year-fbi-says/
Houston Matters,"Rent relief program reopening (March 14, 2023)",https://www.houstonpublicmedia.org/articles/shows/houston-matters/2023/03/14/445876/rent-relief-program-reopening-march-14-2023/
Town Square,Zee Clarke Explains How Breathing and Mindfulness Can Help In Healing from Racial Trauma in Her New Book “Black People Breathe”,https://www.houstonpublicmedia.org/articles/shows/town-square/2023/03/13/446118/zee-clarke-explains-how-breathing-and-mindfulness-can-help-in-healing-from-racial-trauma-in-her-new-book-black-people-breathe/
Transportation,METRO’s University Corridor bus rapid transit line gets $150 million funding recommendation from feds,https://www.houstonpublicmedia.org/articles/news/transportation/2023/03/13/446125/houston-metro-university-brt-150-million-funding-recommendation/
Houston Matters,The road to the Final Four runs through Houston — in more ways than one,https://www.houstonpublicmedia.org/articles/shows/houston-matters/2023/03/13/446066/the-road-to-the-final-four-runs-through-houston-in-more-ways-than-one/
Houston Matters,Don’t let this week’s cool down fool you – it’s time to plant seeds in your garden,https://www.houstonpublicmedia.org/articles/shows/houston-matters/2023/03/13/446046/dont-let-this-weeks-cool-down-fool-you-its-time-to-plant-seeds-in-your-garden/
Houston Matters,Former ambassador to both Russia and Ukraine offers a unique perspective on the war,https://www.houstonpublicmedia.org/articles/shows/houston-matters/2023/03/13/446034/former-ambassador-to-both-russia-and-ukraine-offers-a-unique-perspective-on-the-war/
Sports,Houston gets No. 1 seed in Midwest at expense of Kansas; Texas Southern earns third consecutive NCAA Tournament berth,https://www.houstonpublicmedia.org/articles/news/sports/2023/03/13/446032/houston-gets-no-1-seed-in-midwest-at-expense-of-kansas-texas-southern-earns-third-consecutive-ncaa-tournament-berth/
Houston Matters,"Sixty days in, the real sprint begins for Texas lawmakers in Austin",https://www.houstonpublicmedia.org/articles/shows/houston-matters/2023/03/13/446033/sixty-days-in-the-real-sprint-begins-for-texas-lawmakers-in-austin/
Education,"Texas Senate’s priority bills on higher ed would end tenure, diversity policies",https://www.houstonpublicmedia.org/articles/education/2023/03/13/446024/texas-senates-priority-bills-on-higher-ed-would-end-tenure-diversity-policies/
Travel,Texas officials have told residents Mexico is too dangerous to visit for spring break,https://www.houstonpublicmedia.org/articles/travel/2023/03/13/446020/texas-officials-have-told-residents-mexico-is-too-dangerous-to-visit-for-spring-break/
Border,"Politically motivated border policies, coverage of migrant caravans have done little to curb illegal immigration, Rice University study finds",https://www.houstonpublicmedia.org/articles/news/border/2023/03/13/445991/politically-motivated-border-policies-coverage-of-migrant-caravans-have-done-little-to-curb-illegal-immigration-rice-university-study-finds/
Houston Matters,"UH begins tourney as top seed (March 13, 2023)",https://www.houstonpublicmedia.org/articles/shows/houston-matters/2023/03/13/445874/uh-begins-tourney-as-top-seed-march-13-2023/
Energy & Environment,EPA head visits massive Houston solar project,https://www.houstonpublicmedia.org/articles/news/energy-environment/2023/03/11/445992/epa-head-visits-massive-houston-solar-project/
Medicine & Wellness,Three Texas women are sued for wrongful death after allegedly helping friend obtain abortion medication,https://www.houstonpublicmedia.org/articles/news/health-science/medicine-wellness/2023/03/10/446008/three-texas-women-are-sued-for-wrongful-death-after-allegedly-helping-friend-obtain-abortion-medication/
I SEE U,"I SEE U, Episode 78: Say It Loud! Woosah!",https://www.houstonpublicmedia.org/articles/shows/i-see-u/2023/03/10/445370/i-see-u-episode-78-say-it-loud-woosah/
Business,"Number of jobs in Texas consistently grew over last 16 months, state data shows",https://www.houstonpublicmedia.org/articles/news/business/2023/03/10/445958/number-of-jobs-in-texas-consistently-grew-over-last-16-months-state-data-shows/
Local,M-K-T development in Houston’s Heights hosting pop-up market with free health food,https://www.houstonpublicmedia.org/articles/news/local/2023/03/10/445983/m-k-t-development-in-houstons-heights-hosting-pop-up-market-with-free-health-food/
Medicine & Wellness,"Houston’s Wheeler Baptist Church hosting Sunday event for breast cancer tests, genetic screenings",https://www.houstonpublicmedia.org/articles/news/health-science/medicine-wellness/2023/03/10/445957/houstons-wheeler-baptist-church-hosting-sunday-event-for-breast-cancer-tests-genetic-screenings/
School shooting,Santa Fe High School shooter ordered to get new mental health evaluation by judge,https://www.houstonpublicmedia.org/articles/news/school-shooting/2023/03/10/445944/santa-fe-high-school-shooter-ordered-to-get-new-mental-health-evaluation-by-judge/
Houston Matters,‘It feels like a dark cloud.’ Houston teachers play a waiting game while the TEA decides HISD’s fate,https://www.houstonpublicmedia.org/articles/shows/houston-matters/2023/03/10/445903/it-feels-like-a-dark-cloud-houston-teachers-play-a-waiting-game-while-the-tea-decides-hisds-fate/
Houston Matters,Check out the conceptual sounds of an ‘abstract turntablist’,https://www.houstonpublicmedia.org/articles/shows/houston-matters/2023/03/10/445939/check-out-the-conceptual-sounds-of-an-abstract-turntablist/
Texas,Texas bill requiring 10-year prison sentences for gun felonies faces opposition from criminal justice and firearm advocates,https://www.houstonpublicmedia.org/articles/news/texas/2023/03/10/445933/texas-bill-requiring-10-year-prison-sentences-for-gun-felonies-faces-opposition-from-criminal-justice-and-firearm-advocates/
Harris County,Judge temporarily blocks Texas Comptroller Glenn Hegar’s ruling that Harris County ‘defunded’ law enforcement,https://www.houstonpublicmedia.org/articles/news/harris-county/2023/03/10/445930/judge-temporarily-blocks-comptroller-hegars-ruling-that-harris-county-defunded-law-enforcement/
