section,title,url
National,Trump charged with 34 felony counts in hush money scheme,https://www.houstonpublicmedia.org/articles/news/national/2023/04/04/448245/trump-surrrenders-to-ny-authorities-ahead-of-arraignment/
Harris County,Harris County adopts plan to allocate $750 million in federal Harvey relief funds,https://www.houstonpublicmedia.org/articles/news/harris-county/2023/04/04/448296/harris-county-adopts-plan-to-allocate-750-million-in-federal-harvey-relief-funds/
Food,Black Restaurant Week highlights diverse cross section of Houston-area cuisine,https://www.houstonpublicmedia.org/articles/arts-culture/food/2023/04/04/448287/black-restaurant-week-highlights-diverse-cross-section-of-houston-area-cuisine/
Criminal Justice,Houston barber accused of impersonating police officer to see Megan Thee Stallion at March Madness concert,https://www.houstonpublicmedia.org/articles/news/criminal-justice/2023/04/04/448250/houston-barber-accused-impersonating-officer-megan-thee-stallion-march-madness-concert/
Gun control,"Gun regulations could significantly help reduce firearm deaths among young people, study shows",https://www.houstonpublicmedia.org/articles/news/politics/gun-control/2023/04/04/448240/gun-regulations-could-significantly-help-reduce-firearm-deaths-among-young-people-study-shows/
Energy & Environment,"Gulf of Mexico oil worse for climate than thought, study",https://www.houstonpublicmedia.org/articles/news/energy-environment/2023/04/04/448228/gulf-of-mexico-oil-worse-for-climate-than-thought-study/
Weather,Houston weather: rain expected to bring cooler temps after record-breaking heat,https://www.houstonpublicmedia.org/articles/news/weather/2023/04/03/448112/houston-weather-rain-expected-to-bring-cooler-temps-after-record-breaking-heat/
Sports,2023 Men’s Final Four: UConn wins big over San Diego State to capture national championship,https://www.houstonpublicmedia.org/articles/news/sports/2023/04/03/448190/2023-mens-final-four-live-national-championship-houston-nrg-stadium/
Energy & Environment,Texas has the fifth-highest percentage of water pipes made of lead,https://www.houstonpublicmedia.org/articles/news/energy-environment/2023/04/05/448334/texas-has-the-fifth-highest-percentage-of-water-pipes-made-of-lead/
Politics,Texas Senate votes to defund libraries where drag queens read to kids as it tries to limit the performances kids can attend,https://www.houstonpublicmedia.org/articles/news/politics/2023/04/05/448317/texas-senate-votes-to-defund-libraries-where-drag-queens-read-to-kids-as-it-tries-to-limit-the-performances-kids-can-attend/
Houston Matters,The Full Menu: Dining on a budget in Houston,https://www.houstonpublicmedia.org/articles/shows/houston-matters/2023/04/05/448206/the-full-menu-dining-on-a-budget-in-houston/
Houston Matters,"Historic week in politics (April 5, 2023)",https://www.houstonpublicmedia.org/articles/shows/houston-matters/2023/04/05/447926/historic-week-in-politics-april-5-2023/
Town Square,The Latest on Former President Donald Trump’s Indictment and Arraignment,https://www.houstonpublicmedia.org/articles/shows/town-square/2023/04/04/448292/the-latest-on-former-president-donald-trumps-indictment-and-arraignment/
Houston Matters,How poet Holly Lyn Walrath turns other people’s words into poems — and visual art,https://www.houstonpublicmedia.org/articles/shows/houston-matters/2023/04/04/448256/how-poet-holly-lyn-walrath-turns-other-peoples-words-into-poems-and-visual-art/
Houston Matters,"Policy ideas on mass shootings (April 4, 2023)",https://www.houstonpublicmedia.org/articles/shows/houston-matters/2023/04/04/447923/policy-ideas-to-address-mass-shootings-april-4-2023/
Town Square,Author Katherine Schweit on How To Stop Mass Shootings in the U.S.,https://www.houstonpublicmedia.org/articles/shows/town-square/2023/04/03/448178/author-katherine-schweit-on-how-to-stop-mass-shootings-in-the-u-s/
Flooding,Construction to start soon on Inwood Forest flood-mitigation project in Northwest Houston,https://www.houstonpublicmedia.org/articles/news/flooding/2023/04/03/448139/construction-to-start-soon-on-inwood-forest-flood-mitigation-project-in-northwest-houston/
Harris County,Texas’ chief financial officer walks back claim that Harris County illegally cut constable’s budget,https://www.houstonpublicmedia.org/articles/news/harris-county/2023/04/03/448168/texas-chief-financial-officer-walks-back-claim-that-harris-county-illegally-cut-constables-budget/
Houston,"Yellowstone Schools’ newly renovated campus brings more benefits to students, Third Ward residents",https://www.houstonpublicmedia.org/articles/news/houston/2023/04/03/448161/yellowstone-schools-newly-renovated-campus-brings-more-benefits-to-students-third-ward-residents/
Texas,Texas is growing – and fast. But that growth is not evenly distributed across the state.,https://www.houstonpublicmedia.org/articles/news/texas/2023/04/03/448132/texas-is-growing-and-fast-but-that-growth-is-not-evenly-distributed-across-the-state/
NASA,"NASA’s 1st moon crew in 50 years includes 1 woman, 3 men",https://www.houstonpublicmedia.org/articles/news/nasa/2023/04/03/448118/nasas-1st-moon-crew-in-50-years-includes-1-woman-3-men/
Encore Houston,"Encore Houston, Episode 196: Round Top Music Festival",https://www.houstonpublicmedia.org/articles/shows/encore-houston/2023/04/03/448103/encore-houston-episode-196-round-top-music-festival/
Houston,"Since becoming fine-free, over 21,000 items have been returned to Houston Public Libraries, officials say",https://www.houstonpublicmedia.org/articles/news/houston/2023/04/03/448055/since-becoming-fine-free-over-21000-items-have-been-returned-to-houston-public-libraries-officials-say/
Health & Science,Texas lawmakers consider expanding access to treatment for people experiencing hallucinations or hearing voices,https://www.houstonpublicmedia.org/articles/news/health-science/2023/04/03/447990/texas-lawmakers-consider-expanding-access-to-treatment-for-people-experiencing-hallucinations-or-hearing-voices/
Houston Matters,"Control of Harris County elections (April 3, 2023)",https://www.houstonpublicmedia.org/articles/shows/houston-matters/2023/04/03/447921/control-of-harris-county-elections-april-3-2023/
Sports,"2023 Men’s Final Four: San Diego State wins on buzzer beater, faces UConn in title game",https://www.houstonpublicmedia.org/articles/news/sports/2023/04/01/448068/2023-mens-final-four-live-houston-nrg-stadium/
Town Square,Transgender Icon Kate Bornstein on Her Career and Personal Journey,https://www.houstonpublicmedia.org/articles/shows/town-square/2023/03/31/448002/transgender-icon-kate-bornstein-on-her-career-and-personal-journey/
Texas,New-and-improved Galveston Island State Park expects summer spike in visitors,https://www.houstonpublicmedia.org/articles/news/texas/2023/03/31/448063/new-and-improved-galveston-island-state-park-expects-summer-spike-in-visitors/
Sports,"2023 Men’s Final Four weekend kicks off in Houston with Fan Fest, concerts at Discovery Green",https://www.houstonpublicmedia.org/articles/news/sports/2023/03/31/448031/final-four-kicks-off-in-houston-with-fan-fest-concerts-at-discovery-green/
Houston,"As dozens march to oppose takeover of Houston ISD, ACLU files complaint against TEA",https://www.houstonpublicmedia.org/articles/news/houston/2023/03/31/448007/march-oppose-houston-isd-takeover-aclu-files-complaint-against-tea/
Criminal Justice,Houston man who wielded tomahawk axe at U.S. Capitol insurrection convicted of nine related crimes,https://www.houstonpublicmedia.org/articles/news/criminal-justice/2023/03/31/447998/houston-man-who-wielded-tomahawk-axe-at-u-s-capitol-insurrection-convicted-of-nine-related-crimes/
Party Politics,Houston Mayor race: Sheila Jackson Lee announces candidacy,https://www.houstonpublicmedia.org/articles/shows/party-politics/2023/03/31/447973/houston-mayor-race-sheila-jackson-lee-announces-candidacy/
