section,title,url
Immigration,The U.S. Supreme Court rules Biden administration can end ‘Remain in Mexico’ immigration policy,https://www.houstonpublicmedia.org/articles/news/politics/immigration/2022/06/30/428033/the-u-s-supreme-court-rules-biden-administration-can-end-remain-in-mexico-immigration-policy/
Politics,Supreme Court restricts the EPA’s authority to mandate carbon emissions,https://www.houstonpublicmedia.org/articles/news/politics/2022/06/30/428029/supreme-court-restricts-the-epas-authority-to-mandate-carbon-emissions/
Education,Afghan refugee students in Houston experienced culture shock. Now many are thriving,https://www.houstonpublicmedia.org/articles/education/2022/06/29/428002/afghan-refugee-students-in-houston-experienced-culture-shock-now-many-are-thriving/
Energy & Environment,Community members push back against proposed Carverdale landfill expansion,https://www.houstonpublicmedia.org/articles/news/energy-environment/2022/06/29/427908/community-members-push-back-against-the-proposed-carverdale-landfill-expansion/
Events,LIST: Houston 4th of July events,https://www.houstonpublicmedia.org/articles/events/2022/06/29/428023/list-houston-4th-of-july-events/
Houston Matters,"Sheriff Ed Gonzalez on why he’s withdrawing his nomination to lead ICE (June 29, 2022)",https://www.houstonpublicmedia.org/articles/shows/houston-matters/2022/06/29/427760/sheriff-ed-gonzalez-on-why-hes-withdrawing-his-nomination-to-lead-ice-june-29-2022/
Politics,"Commissioners court passes measures supporting abortion, contraception access",https://www.houstonpublicmedia.org/articles/news/politics/2022/06/28/427893/harris-county-democratic-leaders-move-to-protect-womens-access-to-abortion-and-contraception/
Arts & Culture,Alley Theatre building to be renamed after anonymous $25 million matching grant,https://www.houstonpublicmedia.org/articles/news/arts-culture-news/2022/06/28/427858/alley-theatre-building-to-be-renamed-after-anonymous-25-million-matching-grant/
Houston Matters,"Flooding and pollution in minority communities, and the impact of minority-owned businesses (June 30, 2022)",https://www.houstonpublicmedia.org/articles/shows/houston-matters/2022/06/30/427762/flooding-and-pollution-in-minority-communities-and-the-impact-of-minority-owned-businesses-on-the-houston-economy-june-30-2022/
UH Moment,UH Moment: Art Students Explore Creative Coding in Marfa,https://www.houstonpublicmedia.org/articles/shows/uh-moment/2022/06/29/428007/uh-moment-art-students-explore-creative-coding-in-marfa/
Town Square,"The sixth Jan. 6 hearing: Cassidy Hutchinson’s testimony, metal detectors, seem to help reveal a ‘smoking gun’",https://www.houstonpublicmedia.org/articles/shows/town-square/2022/06/28/427918/the-sixth-jan-6-hearing-cassidy-hutchinsons-testimony-metal-detectors-seem-to-help-reveal-a-smoking-gun/
Texas,"Charles Butt family, H-E-B donate $10 million to replace Robb Elementary School in Uvalde",https://www.houstonpublicmedia.org/articles/news/texas/2022/06/28/427889/charles-butt-family-h-e-b-donate-10-million-to-replace-robb-elementary-school-in-uvalde/
Politics,"Texas judge blocks state’s pre-Roe ban, allows some abortions to continue",https://www.houstonpublicmedia.org/articles/news/politics/2022/06/28/427879/texas-judge-blocks-states-pre-roe-ban-allows-some-abortions-to-continue/
Immigration,"Harris County Sheriff Ed Gonzalez, Biden’s pick to lead immigration enforcement agency, withdraws from nomination",https://www.houstonpublicmedia.org/articles/news/politics/immigration/2022/06/28/427845/harris-county-sheriff-ed-gonzalez-bidens-pick-to-lead-immigration-enforcement-agency-withdraws-from-nomination/
Houston Matters,"How the Roe ruling might affect other reproductive health matters (June 28, 2022)",https://www.houstonpublicmedia.org/articles/shows/houston-matters/2022/06/28/427680/how-the-roe-ruling-might-affect-other-reproductive-health-matters-june-28-2022/
Texas,Death toll rises to 51 after dozens of migrants found trapped in tractor trailer in San Antonio,https://www.houstonpublicmedia.org/articles/news/texas/2022/06/27/427840/at-least-46-found-dead-in-back-of-tractor-trailer-in-san-antonio/
Town Square,Documentary ‘Hiding in Plain Sight: Youth Mental Illness’ airs on PBS,https://www.houstonpublicmedia.org/articles/shows/town-square/2022/06/27/427851/documentary-hiding-in-plain-sight-youth-mental-illness-airs-on-pbs/
Health & Science,Health care providers sue Texas over pre-Roe abortion ban,https://www.houstonpublicmedia.org/articles/news/health-science/2022/06/27/427836/health-care-providers-sue-texas-over-pre-roe-abortion-ban/
Weather,"Chance for rain each day, all week in Houston area",https://www.houstonpublicmedia.org/articles/news/weather/2022/06/27/427828/chance-for-rain-each-day-all-week-in-houston-area/
Texas,FAQ: Why have abortion services already halted in Texas?,https://www.houstonpublicmedia.org/articles/news/texas/2022/06/27/427807/faq-why-have-abortion-services-already-halted-in-texas/
International,"WNBA star Brittney Griner is seen at court, but Russia extends her detention again",https://www.houstonpublicmedia.org/articles/news/international/2022/06/27/427797/wnba-star-brittney-griner-is-seen-at-court-but-russia-extends-her-detention-again/
Politics,Poll: Majorities oppose Supreme Court’s abortion ruling and worry about other rights,https://www.houstonpublicmedia.org/articles/news/politics/2022/06/27/427765/poll-majorities-oppose-supreme-courts-abortion-ruling-and-worry-about-other-rights/
Health Matters,Dealing with Migraines,https://www.houstonpublicmedia.org/articles/shows/health-matters/2022/06/27/427792/dealing-with-migraines-2/
Houston Matters,"What overturning Roe v. Wade signals about politics and the judiciary (June 27, 2022)",https://www.houstonpublicmedia.org/articles/shows/houston-matters/2022/06/27/427661/the-impact-of-minority-owned-businesses-and-addressing-youth-mental-illness-june-27-2022/
Houston,PHOTOS: Houston abortion rights supporters protest overturning of Roe v. Wade,https://www.houstonpublicmedia.org/articles/news/houston/2022/06/24/427728/photos-houston-abortion-rights-supporters-protest-overturning-of-roe-v-wade/
Town Square,"The ramifications of overturning Roe v. Wade –  what it means for women’s health,  and what it means for Texas",https://www.houstonpublicmedia.org/articles/shows/town-square/2022/06/24/427718/the-ramifications-of-overturning-roe-v-wade-what-it-means-for-womens-health-and-what-it-means-for-texas/
News,Plan B and contraceptives remain legal in Texas after U.S. Supreme Court ruling on abortion,https://www.houstonpublicmedia.org/articles/news/2022/06/24/427723/plan-b-and-contraceptives-remain-legal-in-texas-after-u-s-supreme-court-ruling-on-abortion/
I SEE U ,"I SEE U, Episode 19: Women of The Revolution [Encore]",https://www.houstonpublicmedia.org/articles/shows/i-see-u/2022/06/24/427318/i-see-u-episode-19-women-of-the-revolution-encore/
News,U.S. House passes gun control bill; Biden’s desk is next stop,https://www.houstonpublicmedia.org/articles/news/2022/06/24/427707/senate-passes-gun-control-bill-and-sends-it-to-the-house/
Texas,"Roe v. Wade overturned: What Texas, Harris County and Houston leaders are saying",https://www.houstonpublicmedia.org/articles/news/texas/2022/06/24/427694/roe-v-wade-overturned-what-texas-harris-county-and-houston-leaders-are-saying/
Texas,Texas ‘trigger law’ to ban abortion will soon go into effect. Here’s how it works,https://www.houstonpublicmedia.org/articles/news/texas/2022/06/24/427684/texas-trigger-law-to-ban-abortion-will-soon-go-into-effect-heres-how-it-works/
Politics,Supreme Court overturns Roe v. Wade,https://www.houstonpublicmedia.org/articles/news/politics/2022/06/24/427675/supreme-court-overturns-roe-v-wade/
