section,title,url
Transportation,"Houston Midtown Greyhound bus station to end service Thursday, property still listed for sale",https://www.houstonpublicmedia.org/articles/news/transportation/2023/11/29/470896/midtown-greyhound-bus-services-to-end-thursday-property-still-listed-for-sale/
Houston,Workers rights case highlights the struggle immigrant women face in the workplace,https://www.houstonpublicmedia.org/articles/news/houston/2023/11/29/470641/workers-rights-case-houston-shutters-struggle-immigrant-women-face-workplace/
Transportation,"Houston officials create truck route plan, limiting 18 wheelers on certain city streets",https://www.houstonpublicmedia.org/articles/news/transportation/2023/11/29/470992/houston-truck-route-plan-limiting-18-wheelers-on-certain-streets/
Houston Mayor,Mayor Sylvester Turner calls John Whitmire’s diversity comment a “dog whistle” on his administration,https://www.houstonpublicmedia.org/articles/news/houston-mayor/2023/11/29/470955/mayor-sylvester-turner-calls-john-whitmires-diversity-comment-a-dog-whistle-on-his-administration/
Fort Bend,Fort Bend small town Weston Lakes swears in mayor for second term after canceled election,https://www.houstonpublicmedia.org/articles/news/fort-bend/2023/11/29/471009/fort-bend-small-town-weston-lakes-swears-in-mayor-for-second-term-after-canceled-election/
Polls,Mayor Sylvester Turner gets relatively high marks from likely voters as he prepares to depart,https://www.houstonpublicmedia.org/articles/news/polls/2023/11/29/470807/mayor-sylvester-turner-gets-relatively-high-marks-from-likely-voters-as-he-prepares-to-depart/
Education News,"Rice University relocates statue, remains of slave-owning founder as part of quad redesign",https://www.houstonpublicmedia.org/articles/news/education-news/2023/11/29/470982/rice-university-relocates-statue-remains-of-slave-owning-founder-as-part-of-quad-redesign/
Books & Libraries,Controversial League City library book policy draft draws termination of city attorney,https://www.houstonpublicmedia.org/articles/education/books-libraries/2023/11/29/470984/controversial-league-city-library-book-policy-draft-draws-termination-of-city-attorney/
Harris County,Former Lina Hidalgo staffer under indictment in Harris County seeks to void new search warrants,https://www.houstonpublicmedia.org/articles/news/harris-county/2023/11/29/471045/former-lina-hidalgo-staffer-under-indictment-in-harris-county-seeks-to-void-new-search-warrants/
Weather,"Houston area had quiet year for hurricane season, meteorologist says",https://www.houstonpublicmedia.org/articles/news/weather/2023/11/29/471046/houston-area-had-quiet-year-for-hurricane-season-meteorologist-says/
Criminal Justice,"Detention officer arrested, accused of smuggling marijuana into the Harris County Jail",https://www.houstonpublicmedia.org/articles/news/criminal-justice/2023/11/29/470958/detention-officer-arrested-accused-of-smuggling-marijuana-into-the-harris-county-jail/
Houston Matters,Two friends remain connected through their experience with breast cancer,https://www.houstonpublicmedia.org/articles/shows/houston-matters/2023/11/29/470910/two-friends-remain-connected-through-their-experience-with-breast-cancer/
Voting,U.S. 5th Circuit sets Galveston County redistricting case appeal for May 2024,https://www.houstonpublicmedia.org/articles/voting/2023/11/29/470971/u-s-5th-circuit-sets-galveston-county-redistricting-case-appeal-for-may-2024/
Houston Matters,Political Roundup: Assessing the mayoral runoff,https://www.houstonpublicmedia.org/articles/shows/houston-matters/2023/11/29/470912/political-roundup-assessing-the-mayoral-runoff/
Transportation,US mediators reject attempt by American Airlines flight attendants to clear the path for a strike,https://www.houstonpublicmedia.org/articles/news/transportation/2023/11/29/470899/us-mediators-reject-attempt-by-american-airlines-flight-attendants-to-clear-the-path-for-a-strike/
Houston Matters,"Abortion law at the Texas Supreme Court (Nov. 29, 2023)",https://www.houstonpublicmedia.org/articles/shows/houston-matters/2023/11/29/470608/abortion-law-at-the-texas-supreme-court-nov-29-2023/
Houston Matters,How a background in improv helps Ben Schwartz voice Sonic the Hedgehog,https://www.houstonpublicmedia.org/articles/shows/houston-matters/2023/11/28/470872/how-a-background-in-improv-helps-ben-schwartz-voice-sonic-the-hedgehog/
Court,Texas Supreme Court will decide if the state’s abortion ban causes harm to patients and doctors,https://www.houstonpublicmedia.org/articles/court/2023/11/28/470878/texas-supreme-court-will-decide-if-the-states-abortion-ban-causes-harm-to-patients-and-doctors/
Animals,"As temperatures drop in Houston, feral hogs can be seen closer inside city limits",https://www.houstonpublicmedia.org/articles/news/energy-environment/animals/2023/11/28/470866/feral-hogs-houston-temperatures-drop-seen-closer-city-limits/
Houston Matters,"Gulf Coast oil spill likely to have small impact in Texas, expert says",https://www.houstonpublicmedia.org/articles/shows/houston-matters/2023/11/28/470820/gulf-coast-oil-spill-likely-to-have-small-impact-in-texas-expert-says/
Fort Bend,Fort Bend County Animal Services at more than double capacity for dogs,https://www.houstonpublicmedia.org/articles/news/fort-bend/2023/11/28/470850/fort-bend-county-animal-services-at-more-than-double-capacity-for-dogs/
Elections,"Jackson Lee, Whitmire vie on priorities ahead of Houston mayoral runoff election",https://www.houstonpublicmedia.org/articles/news/politics/elections/2023/11/28/470835/jackson-lee-whitmire-vie-on-priorities-ahead-of-houston-mayoral-runoff-election/
Houston Matters,Teacher shortages are only getting worse – even in Houston,https://www.houstonpublicmedia.org/articles/shows/houston-matters/2023/11/28/470814/teacher-shortages-are-only-getting-worse-even-in-houston/
Houston Matters,The King’s Singers bring familiar tunes to Houston,https://www.houstonpublicmedia.org/articles/shows/houston-matters/2023/11/28/470789/the-kings-singers-bring-familiar-tunes-to-houston/
Politics,Kamala Harris touts White House record at Latino event in Houston ahead of 2024,https://www.houstonpublicmedia.org/articles/news/politics/2023/11/28/470794/kamala-harris-houston-touts-white-house-record-at-latino-event-ahead-of-2024/
Animals,"Unknown respiratory illness appears to have increased in Texas dogs, veterinarian says",https://www.houstonpublicmedia.org/articles/news/energy-environment/animals/2023/11/28/470788/unknown-respiratory-illness-texas-dogs-increase-cases/
Texas,More than two-thirds of Texas’ 30.3 million residents live in four largest metro areas,https://www.houstonpublicmedia.org/articles/news/texas/2023/11/28/470773/more-than-two-thirds-of-texas-30-3-million-residents-live-in-four-largest-metro-areas/
Houston,"Police, family continue Houston search for missing California mother",https://www.houstonpublicmedia.org/articles/news/houston/2023/11/28/470776/police-family-continue-houston-search-for-missing-california-mother/
Health & Science,"Texas abortion case goes before state’s highest court, as more women join lawsuit",https://www.houstonpublicmedia.org/articles/news/health-science/2023/11/28/470767/texas-abortion-case-goes-before-states-highest-court-as-more-women-join-lawsuit/
Briefcase,Bill of Rights: The Fifteenth Amendment,https://www.houstonpublicmedia.org/articles/shows/briefcase/2023/11/28/470933/bill-of-rights-the-fifteenth-amendment/
Houston Matters,"Oil spill in the Gulf of Mexico (Nov. 28, 2023)",https://www.houstonpublicmedia.org/articles/shows/houston-matters/2023/11/28/470606/oil-spill-in-the-gulf-of-mexico-nov-28-2023/
Houston Matters,"Houston had an eventful weekend in sports. A local expert discusses the Rockets, Texans, Dynamo, and more",https://www.houstonpublicmedia.org/articles/shows/houston-matters/2023/11/27/470710/houston-had-an-eventful-weekend-in-sports-a-local-expert-discusses-the-rockets-texans-dynamo-and-more/
