section,title,url
School shooting,Five DPS officers face probe over response to Uvalde shooting,https://www.houstonpublicmedia.org/articles/news/school-shooting/2022/09/07/432375/five-dps-officers-face-probe-over-response-to-uvalde-shooting/
Sports,Northbrook High School football team celebrates first win in five years,https://www.houstonpublicmedia.org/articles/news/sports/2022/09/07/432357/northbrook-high-school-football-team-celebrates-first-win-in-five-years/
Housing,New Houston-area initiative hopes to make homeownership affordable for people of color,https://www.houstonpublicmedia.org/articles/housing/2022/09/06/432336/new-houston-area-initiative-hopes-to-make-homeownership-affordable-for-people-of-color/
Health & Science,COVID-19 boosters targeting Omicron variant now available in Houston,https://www.houstonpublicmedia.org/articles/news/health-science/2022/09/06/432308/covid-19-boosters-targeting-omicron-variant-now-available-in-houston/
School shooting,Uvalde students return to school for the first time since May’s deadly shooting,https://www.houstonpublicmedia.org/articles/news/school-shooting/2022/09/06/432273/uvalde-students-return-to-school-for-the-first-time-since-mays-deadly-shooting/
Houston,Houston’s new noise ordinance for bars and clubs now in effect,https://www.houstonpublicmedia.org/articles/news/houston/2022/09/06/432299/houstons-new-noise-ordinance-for-bars-and-clubs-now-in-effect/
Sports,Houston Texans to host Uvalde high school team at season opener,https://www.houstonpublicmedia.org/articles/news/sports/2022/09/06/432295/texans-to-host-uvalde-high-school-team-at-season-opener/
School shooting,This teacher survived the Uvalde shooting. Here’s why she is returning to the job,https://www.houstonpublicmedia.org/articles/news/school-shooting/2022/09/02/432217/this-teacher-survived-the-uvalde-shooting-heres-why-she-is-returning-to-the-job/
Houston Matters,The Full Menu: Best food halls in Houston,https://www.houstonpublicmedia.org/articles/shows/houston-matters/2022/09/07/432303/the-full-menu-best-food-halls-in-houston/
Houston Matters,"Addressing violent crime, and Houston’s best food halls (Sept. 7, 2022)",https://www.houstonpublicmedia.org/articles/shows/houston-matters/2022/09/07/432284/addressing-violent-crime-and-houstons-best-food-halls-sept-7-2022/
Arts & Culture,Huntsville residents push back after city removes ‘Read With Pride’ display from public library,https://www.houstonpublicmedia.org/articles/news/arts-culture-news/2022/09/06/432325/huntsville-residents-push-back-after-city-removes-read-with-pride-display-from-public-library/
Energy & Environment,Residents and advocates are hopeful for change as the DOJ begins investigating illegal dumping in Houston,https://www.houstonpublicmedia.org/articles/news/energy-environment/2022/09/06/432240/residents-and-advocates-are-hopeful-for-change-as-the-doj-begins-investigating-illegal-dumping-in-houston/
Houston Matters,"Vaccine boosters target omicron, and writer Erika L. Sanchez (Sept. 6, 2022)",https://www.houstonpublicmedia.org/articles/shows/houston-matters/2022/09/06/431917/vaccine-boosters-target-omicron-and-writer-erika-l-sanchez-sept-6-2022/
I SEE U ,"I SEE U, Episode 56: Play That Funky Music, Brian Culbertson",https://www.houstonpublicmedia.org/articles/shows/i-see-u/2022/09/02/432175/i-see-u-episode-56-play-that-funky-music-brian-culbertson/
Houston,"Houston donates water to Jackson, MS amid its water crisis",https://www.houstonpublicmedia.org/articles/news/houston/2022/09/02/432230/houston-donates-water-to-jackson-ms-amid-its-water-crisis/
Immigration,Gov. Greg Abbott’s migrant busing program is what asylum advocates wanted all along,https://www.houstonpublicmedia.org/articles/news/politics/immigration/2022/09/02/432227/gov-greg-abbotts-migrant-busing-program-is-what-asylum-advocates-wanted-all-along/
Texas,Pregnant woman who claimed her fetus was an HOV lane passenger gets another ticket,https://www.houstonpublicmedia.org/articles/news/texas/2022/09/02/432213/pregnant-woman-who-claimed-her-fetus-was-an-hov-lane-passenger-gets-another-ticket/
Theatre & Film,Celebrate National Cinema Day with discounted tickets at theaters across Houston,https://www.houstonpublicmedia.org/articles/arts-culture/theatre-film/2022/09/02/432210/celebrate-national-cinema-day-with-discounted-tickets-at-theaters-across-houston/
Houston Matters,"Houston’s connections to the voter fraud movement (Sept. 2, 2022)",https://www.houstonpublicmedia.org/articles/shows/houston-matters/2022/09/02/431915/houstons-ties-to-the-voter-fraud-movement-sept-2-2022/
Houston Matters,"Life expectancy continues to fall: The Good, Bad, and Ugly of the week",https://www.houstonpublicmedia.org/articles/shows/houston-matters/2022/09/02/431919/life-expectancy-continues-to-fall-the-good-bad-and-ugly-of-the-week/
Immigration,"With a court ruling looming, young Texas immigrants prepare for the possible end of DACA",https://www.houstonpublicmedia.org/articles/news/politics/immigration/2022/09/01/432195/with-a-court-ruling-looming-young-texas-immigrants-prepare-for-the-possible-end-of-daca/
Texas,"Poll: One year after SB 8, Texans express strong support for abortion rights",https://www.houstonpublicmedia.org/articles/news/texas/2022/09/01/432190/poll-one-year-after-sb-8-texans-express-strong-support-for-abortion-rights/
Weather,"Texas’ heat index could reach 125 degrees over the next 30 years, study finds",https://www.houstonpublicmedia.org/articles/news/weather/2022/09/01/432185/texas-heat-index-could-reach-125-degrees-over-the-next-30-years-study-finds/
Sports,Houston Rockets harken history with San Diego gold-and-green uniforms for 2022-23 season,https://www.houstonpublicmedia.org/articles/news/sports/2022/09/01/432165/rockets-harken-history-with-special-gold-and-green-uniforms-for-upcoming-season/
Court,Seabrook man sentenced to prison for role in U.S. Capitol insurrection,https://www.houstonpublicmedia.org/articles/court/2022/09/01/432155/seabrook-man-sentenced-to-prison-for-role-in-insurrection-at-u-s-capitol/
Weather,"August in Houston concludes with milder weather, no named tropical storms entire month",https://www.houstonpublicmedia.org/articles/news/weather/2022/09/01/432148/august-in-houston-concludes-with-milder-weather-no-named-tropical-storms-entire-month/
News,"Reading and math scores fell sharply during pandemic, data show",https://www.houstonpublicmedia.org/articles/news/2022/09/01/432151/reading-and-math-scores-fell-sharply-during-pandemic-data-show/
Politics,Gov. Abbott says increasing the age to buy assault weapons in Texas is unconstitutional,https://www.houstonpublicmedia.org/articles/news/politics/2022/09/01/432140/gov-abbott-says-increasing-the-age-to-buy-assault-weapons-in-texas-is-unconstitutional/
NASA,"Houston artist creates mural at Johnson Space Center, meets astronauts at Cape Canaveral",https://www.houstonpublicmedia.org/articles/news/nasa/2022/09/01/432134/houston-artist-creates-mural-at-johnson-space-center/
News,New lawsuits say Lyft failed to protect its users from physical and sexual assault,https://www.houstonpublicmedia.org/articles/news/2022/09/01/432126/new-lawsuits-say-lyft-failed-to-protect-its-users-from-physical-and-sexual-assault/
Travel,"Amid Labor Day weekend travel surge, airlines promise better customer service",https://www.houstonpublicmedia.org/articles/travel/2022/09/01/432122/amid-labor-day-weekend-travel-surge-airlines-promise-better-customer-service/
Houston Matters,"Politics from the pulpit, and lessons from a career in Texas politics (Sept. 1, 2022)",https://www.houstonpublicmedia.org/articles/shows/houston-matters/2022/09/01/431912/politics-from-the-pulpit-and-lessons-from-a-career-in-texas-politics-sept-1-2022/
