section,title,url
HISD,"Houston ISD approves $2.2 billion budget, suspends magnet school policy",https://www.houstonpublicmedia.org/articles/news/education-news/hisd/2023/06/23/455028/hisd-approved-2-2-billion-budget-suspend-magnet-school-policy/
Energy & Environment,Ike Dike work closer to starting after $550 million appropriation from Texas Legislature,https://www.houstonpublicmedia.org/articles/news/energy-environment/2023/06/22/455014/ike-dike-texas-legislature-550-million-appropriation/
Sports,Houston Rockets get even younger in the NBA draft,https://www.houstonpublicmedia.org/articles/news/sports/2023/06/23/455052/houston-rockets-get-even-younger-in-the-nba-draft/
News,"Hispanics officially make up the biggest share of Texas’ population, new census numbers show",https://www.houstonpublicmedia.org/articles/news/2023/06/23/455085/hispanics-officially-make-up-the-biggest-share-of-texas-population-new-census-numbers-show/
Events,Houston Pride Parade 2023: Crowds expected to gather downtown for Saturday night event,https://www.houstonpublicmedia.org/articles/events/2023/06/22/454975/houston-pride-parade-2023-downtown-saturday-night/
Housing,"Galveston ‘riskiest’ town to buy a beach house due to rising sea levels, insurance broker says",https://www.houstonpublicmedia.org/articles/housing/2023/06/22/454980/galveston-riskiest-town-to-buy-a-beach-house-due-to-rising-sea-levels-insurance-broker-says/
Health & Science,Nearly 2 million Texans are about to lose Medicaid coverage,https://www.houstonpublicmedia.org/articles/news/health-science/2023/06/22/454968/nearly-2-million-texans-are-about-to-lose-medicaid-coverage/
Politics,"Ken Paxton’s impeachment trial will begin Sept. 5, with his attendance required",https://www.houstonpublicmedia.org/articles/news/politics/2023/06/22/454929/ken-paxtons-impeachment-trial-will-begin-sept-5-with-his-attendance-required/
Harris County,Harris County opens long-planned George H.W. Bush Community Center in Spring,https://www.houstonpublicmedia.org/articles/news/harris-county/2023/06/23/455088/harris-county-opens-long-planned-george-h-w-bush-community-center-in-spring/
Technology,Study: Hotel guests are most accepting of AI technology with perceived benefits,https://www.houstonpublicmedia.org/articles/technology/2023/06/23/455039/study-hotel-guests-are-most-accepting-of-ai-technology-with-perceived-benefits/
Houston Matters,"Revisiting a study on college athletes (June 23, 2023)",https://www.houstonpublicmedia.org/articles/shows/houston-matters/2023/06/23/454056/revisiting-a-study-on-college-athletes-june-23-2023/
Houston Matters,"Elephant yoga: The Good, Bad, and Ugly of the week",https://www.houstonpublicmedia.org/articles/shows/houston-matters/2023/06/23/454062/elephant-yoga-the-good-bad-and-ugly-of-the-week/
Town Square,"The 2023 Housing Market & What To Know About Homeownership; Plus, Houston Habitat for Humanity’s Master-Planned Community",https://www.houstonpublicmedia.org/articles/shows/town-square/2023/06/22/455015/the-2023-housing-market-plus-houston-habitat-for-humanitys-master-planned-community/
Sports,MLB commissioner regrets giving immunity to Houston Astros players in sign stealing scandal,https://www.houstonpublicmedia.org/articles/news/sports/2023/06/22/454996/houston-astros-manfred-immunity-sign-stealin/
Politics,Former Republican Congressman Will Hurd announces 2024 presidential bid,https://www.houstonpublicmedia.org/articles/news/politics/2023/06/22/454971/former-republican-congressman-will-hurd-announces-2024-presidential-bid/
Weather,"Tornado near Lubbock kills four people, town still without power",https://www.houstonpublicmedia.org/articles/news/weather/2023/06/22/454940/tornado-near-lubbock-kills-four-people-town-still-without-power/
Houston Matters,It’s that week again – time to talk about cephalopods!,https://www.houstonpublicmedia.org/articles/shows/houston-matters/2023/06/22/454953/its-that-week-again-time-to-talk-about-cephalopods/
Houston Matters,David Gessner’s “Traveler’s Guide to the End of the World” mixes environmentalism with much-needed humor,https://www.houstonpublicmedia.org/articles/shows/houston-matters/2023/06/22/454944/david-gessners-travelers-guide-to-the-end-of-the-world-mixes-environmentalism-with-much-needed-humor/
Houston Matters,“I was today years old when I learned [blank] about Houston”,https://www.houstonpublicmedia.org/articles/shows/houston-matters/2023/06/22/454937/i-was-today-years-old-when-i-learned-blank-about-houston/
Climate Change,Feds reviewing best way to conserve East Texas forests,https://www.houstonpublicmedia.org/articles/climate-change/2023/06/22/454907/national-forests-in-texas-have-no-old-growth-trees/
Weather,97 MPH wind gust at Intercontinental as summer storm knocks out power across Houston region,https://www.houstonpublicmedia.org/articles/news/weather/2023/06/22/454924/97-wind-gust-houston-airport-summer-storm-knocks-out-power/
Houston Matters,"I was today-years-old when I learned… (June 22, 2023)",https://www.houstonpublicmedia.org/articles/shows/houston-matters/2023/06/22/454054/i-was-today-years-old-when-i-learned-june-22-2023/
HISD,"Teacher who wanted to speak at Houston ISD board meeting arrested, charged with criminal trespassing",https://www.houstonpublicmedia.org/articles/news/education-news/hisd/2023/06/21/454893/houston-isd-board-meeting-teacher-arrested-charged-criminal-trespassing/
Town Square,Understanding Gender Identity,https://www.houstonpublicmedia.org/articles/shows/town-square/2023/06/21/454889/understanding-gender-identity/
Police,"Houston police officer accused of shooting wife fired, department says",https://www.houstonpublicmedia.org/articles/police/2023/06/21/454891/houston-police-officer-accused-of-shooting-wife-fired-department-says/
Religion,First Christian Church Katy gets donations from around U.S. after string of Pride flag thefts,https://www.houstonpublicmedia.org/articles/news/religion/2023/06/21/454871/katy-church-pride-flags-donated-after-thefts/
Houston Matters,"Today’s the day to make some music, Houston",https://www.houstonpublicmedia.org/articles/shows/houston-matters/2023/06/21/454850/todays-the-day-to-make-some-music-houston/
HISD,Houston ISD announces ‘family events’ dates for parents to learn about changes,https://www.houstonpublicmedia.org/articles/news/education-news/hisd/2023/06/21/454839/houston-isd-family-events-dates-parents-learn-about-changes/
Politics,"Half of Texas voters believe the impeachment of Ken Paxton was justified, poll finds",https://www.houstonpublicmedia.org/articles/news/politics/2023/06/21/454861/half-of-texas-voters-believe-the-impeachment-of-ken-paxton-was-justified-poll-finds/
Music,Houston celebrates the summer solstice with Make Music Day. Here’s where you can participate.,https://www.houstonpublicmedia.org/articles/arts-culture/music/2023/06/21/454847/houston-celebrates-the-summer-solstice-with-make-music-day-heres-where-you-can-participate/
Houston Matters,New laws targeting Harris County represent “a major monkey wrench” in elections this fall,https://www.houstonpublicmedia.org/articles/shows/houston-matters/2023/06/21/454851/new-laws-targeting-harris-county-represent-a-major-monkey-wrench-in-elections-this-fall/
Houston Matters,Political roundup: How Texas GOP leaders “feuding” is influencing what is and isn’t happening in Austin,https://www.houstonpublicmedia.org/articles/shows/houston-matters/2023/06/21/454837/political-roundup-how-texas-gop-leaders-feuding-is-influencing-what-is-and-isnt-happening-in-austin/
