section,title,url
News,Appeals court upholds Texas block on school mask mandates,https://www.houstonpublicmedia.org/articles/news/2022/07/27/429204/appeals-court-upholds-texas-block-on-school-mask-mandates/
Elections,Texas lawmakers ordered to turn over redistricting records,https://www.houstonpublicmedia.org/articles/news/politics/elections/2022/07/26/429123/texas-lawmakers-ordered-to-turn-over-redistricting-records/
Houston Matters,A new law would require breaks for outside workers. Its sponsor says it’s long overdue,https://www.houstonpublicmedia.org/articles/shows/houston-matters/2022/07/26/429121/a-new-law-would-require-breaks-for-outside-workers-its-sponsor-says-its-long-overdue/
News,$2.4 million needed to address Bellaire aging infrastructure,https://www.houstonpublicmedia.org/articles/news/2022/07/26/429128/2-4-million-needed-to-address-bellaire-aging-infrastructure/
Criminal Justice,Brittney Griner’s Russian trial considers medicinal use of cannabis,https://www.houstonpublicmedia.org/articles/news/criminal-justice/2022/07/26/429103/brittney-griners-russian-trial-considers-medicinal-use-of-cannabis/
Health & Science,"Because of Texas abortion law, her wanted pregnancy became a medical nightmare",https://www.houstonpublicmedia.org/articles/news/health-science/2022/07/26/429096/because-of-texas-abortion-law-her-wanted-pregnancy-became-a-medical-nightmare/
Texas,Uvalde’s Robb Elementary principal placed on administrative leave,https://www.houstonpublicmedia.org/articles/news/texas/2022/07/26/429132/uvaldes-robb-elementary-principal-placed-on-administrative-leave/
Health & Science,Houston doctor suspended for vaccine misinformation files $25 million defamation lawsuit against Methodist Hospital,https://www.houstonpublicmedia.org/articles/news/health-science/2022/07/25/429010/houston-doctor-suspended-for-vaccine-misinformation-files-25-million-defamation-lawsuit-against-methodist-hospital/
International,Brittney Griner says she received ‘a fraction’ of translation at her arrest,https://www.houstonpublicmedia.org/articles/news/international/2022/07/27/429201/brittney-griner-says-she-received-a-fraction-of-translation-at-her-arrest/
Houston Matters,"Drought conditions, the week in politics, and the life of George H.W. Bush (July 27, 2022)",https://www.houstonpublicmedia.org/articles/shows/houston-matters/2022/07/27/428991/drought-conditions-the-week-in-politics-and-the-life-of-george-hw-bush-july-27-2022/
Town Square,"Monkeypox is ‘not an LGBTQ disease, it just happened to hit this community first’ says Houston resident",https://www.houstonpublicmedia.org/articles/shows/town-square/2022/07/26/429164/monkeypox-is-not-an-lgbtq-disease-it-just-happened-to-hit-this-community-first-says-houston-resident/
Health & Science,Houston man battling monkeypox looks forward to return to normalcy,https://www.houstonpublicmedia.org/articles/news/health-science/2022/07/26/429166/houston-man-battling-monkeypox-looks-forward-to-return-to-normalcy/
Weather,Texas heat forces some outdoor workers to modify schedules and adjust work patterns,https://www.houstonpublicmedia.org/articles/news/weather/2022/07/26/429150/texas-heat-forces-some-outdoor-workers-to-modify-schedules-and-adjust-work-patterns/
Houston Matters,"Rep. Sylvia Garcia on paid rest breaks for construction workers (July 26, 2022)",https://www.houstonpublicmedia.org/articles/shows/houston-matters/2022/07/26/428989/rep-sylvia-garcia-on-paid-rest-breaks-for-construction-workers-july-26-2022/
Town Square,"Texas celebrity chef Tiffany Derry talks new show, ‘The Great American Recipe’ airing on PBS",https://www.houstonpublicmedia.org/articles/shows/town-square/2022/07/25/429078/texas-celebrity-chef-tiffany-derry-talks-new-show-the-great-american-recipe-airing-on-pbs/
Health & Science,Monkeypox cases rise to 57 as local leaders plead for more vaccines,https://www.houstonpublicmedia.org/articles/news/health-science/2022/07/25/429058/monkeypox-cases-rise-to-57-local-leaders-call-for-more-vaccines/
Energy & Environment,Community activists hopeful for change after DOJ launches investigation into illegal dumping,https://www.houstonpublicmedia.org/articles/news/energy-environment/2022/07/25/429059/community-activists-hopeful-for-change-after-doj-launches-investigation-into-illegal-dumping/
News,Woman shot by Dallas Police after opening fire at Dallas Love Field,https://www.houstonpublicmedia.org/articles/news/2022/07/25/429062/woman-shot-by-dallas-police-after-opening-fire-at-dallas-love-field/
Sports,"Recovery from rare leukemia could be quick for Texans’ John Metchie III, cancer experts say",https://www.houstonpublicmedia.org/articles/news/sports/2022/07/25/429043/recovery-from-rare-leukemia-could-be-quick-for-texans-john-metchie-iii-cancer-experts-say/
Weather,Thunderstorms could be on the way. But scorching temps here to stay,https://www.houstonpublicmedia.org/articles/news/weather/2022/07/25/429044/thunderstorms-could-be-on-the-way-but-scorching-temps-here-to-stay/
Criminal Justice,Do police officers view themselves differently as public perception of them changes?,https://www.houstonpublicmedia.org/articles/news/criminal-justice/2022/07/25/429032/do-police-officers-view-themselves-differently-as-public-perception-of-them-changes/
Education,Harris County students will have equine therapy center in the coming years,https://www.houstonpublicmedia.org/articles/education/2022/07/25/429025/harris-county-students-will-have-equine-therapy-center-this-school-year/
Sports,"San Antonio, Houston and Arlington chosen for XFL reboot",https://www.houstonpublicmedia.org/articles/news/sports/2022/07/25/428975/san-antonio-houston-and-arlington-chosen-for-xfl-reboot/
Energy & Environment,Gasoline prices are soaring well above the price of crude oil. Here’s why,https://www.houstonpublicmedia.org/articles/news/energy-environment/2022/07/25/428811/gasoline-prices-are-soaring-well-above-the-price-of-crude-oil-heres-why/
Houston Matters,"Race and Houston’s response to illegal dumping (July 25, 2022)",https://www.houstonpublicmedia.org/articles/shows/houston-matters/2022/07/25/428660/race-and-houstons-response-to-illegal-dumping-july-25-2022/
Town Square,Presidential historian says Trump’s ‘dereliction of duty’ should also be seen as criminal conduct,https://www.houstonpublicmedia.org/articles/shows/town-square/2022/07/22/428936/presidential-historian-says-trumps-dereliction-of-duty-should-also-be-seen-as-criminal-conduct/
Events,LIST: Celebrate National Tequila Day at these Houston restaurants,https://www.houstonpublicmedia.org/articles/events/2022/07/22/428940/list-celebrate-national-tequila-day-at-these-houston-restaurants/
The Uvalde Shooting,Uvalde school district cancels meeting on whether to fire police chief,https://www.houstonpublicmedia.org/articles/news/politics/2022/07/22/428945/uvalde-district-meeting-to-determine-police-chiefs-future-canceled/
I SEE U,"I SEE U, Episode 9: Vietnamese Fishermen v. the KKK [Encore]",https://www.houstonpublicmedia.org/articles/shows/2022/07/22/428882/i-see-u-episode-9-vietnamese-fishermen-v-the-kkk-encore/
Houston Matters,Monkeypox in Houston: Here’s what you should know,https://www.houstonpublicmedia.org/articles/news/health-science/2022/07/22/428922/monkeypox-in-houston-heres-what-you-should-know/
Energy & Environment,A massive wind farm project is being proposed along the coast of Galveston,https://www.houstonpublicmedia.org/articles/news/energy-environment/2022/07/22/428872/a-massive-wind-farm-project-is-being-proposed-along-the-coast-of-galveston/
Energy & Environment,Union Pacific can’t have a Houston pollution lawsuit tossed over free speech claims,https://www.houstonpublicmedia.org/articles/news/energy-environment/2022/07/22/428905/union-pacific-cant-have-a-houston-pollution-lawsuit-tossed-over-free-speech-claims/
