section,title,url
Health & Science,"Houston monkeypox cases rise to nearly 200, officials say",https://www.houstonpublicmedia.org/articles/news/health-science/2022/08/10/430421/monkeypox-cases-continue-to-rise-nearly-200-cases-in-houston/
Politics,"Greg Abbott agrees to one debate with Beto O’Rourke, but O’Rourke wants more",https://www.houstonpublicmedia.org/articles/news/politics/2022/08/10/430412/greg-abbott-agrees-to-one-debate-with-beto-orourke-but-orourke-wants-more/
Business,New Houston Methodist employee reprimanded for showing confederate flag during virtual orientation,https://www.houstonpublicmedia.org/articles/news/business/2022/08/09/430307/new-houston-methodist-employee-reprimanded-for-showing-confederate-flag-during-virtual-orientation/
Energy & Environment,"Houston gasoline prices fall to their lowest levels in nearly half a year, thanks to lower crude prices and a decline in demand",https://www.houstonpublicmedia.org/articles/news/energy-environment/2022/08/09/430347/houston-gasoline-prices-fall-to-their-lowest-levels-in-nearly-half-a-year-thanks-to-lower-crude-prices-and-a-decline-in-demand/
Traffic,Galveston officials to address golf cart safety in wake of fatal collision,https://www.houstonpublicmedia.org/articles/news/traffic/2022/08/09/430383/galveston-officials-to-address-golf-cart-safety-in-wake-of-fatal-collision/
Education,Uvalde CISD adds virtual learning option for families reeling from mass shooting,https://www.houstonpublicmedia.org/articles/education/2022/08/09/430375/uvalde-cisd-adds-virtual-learning-option-for-families-reeling-from-mass-shooting/
Local,Pearland Little Leaguers headed to Little League World Series,https://www.houstonpublicmedia.org/articles/news/local/2022/08/09/430306/pearland-little-leaguers-headed-to-world-series/
Below the Waterlines,"Five years after Harvey, a solution to the flood threat from the Addicks and Barker Reservoirs remains a long way off",https://www.houstonpublicmedia.org/articles/shows/below-the-waterlines/2022/08/09/429488/five-years-after-harvey-a-solution-to-the-flood-threat-from-the-addicks-and-barker-reservoirs-remains-a-long-way-off/
Politics,Texas Republicans rally around Trump after FBI search of former president’s Florida estate,https://www.houstonpublicmedia.org/articles/news/politics/2022/08/10/430438/texas-republicans-rally-around-trump-after-fbi-search-of-former-presidents-florida-estate/
Health & Science,How Houston played a big part in the history of breast augmentation,https://www.houstonpublicmedia.org/articles/news/health-science/2022/08/10/430427/how-houston-played-a-big-part-in-the-history-of-breast-augmentation/
Voting,"Most Americans support using the popular vote to decide U.S. presidents, data shows",https://www.houstonpublicmedia.org/articles/voting/2022/08/10/430404/most-americans-support-using-the-popular-vote-to-decide-u-s-presidents-data-shows/
Houston Matters,"Why teacher morale is so low, and the week in politics (Aug. 10, 2022)",https://www.houstonpublicmedia.org/articles/shows/houston-matters/2022/08/10/430044/why-teacher-morale-is-so-low-and-the-week-in-politics-aug-10-2022/
Town Square,FBI raid on Donald Trump’s Mar-a-Lago residence is the first in presidential history,https://www.houstonpublicmedia.org/articles/shows/town-square/2022/08/09/430394/fbi-raid-on-donald-trumps-mar-a-lago-residence-is-the-first-in-presidential-history/
Health Matters,Back to School Vaccines,https://www.houstonpublicmedia.org/articles/shows/health-matters/2022/08/09/430370/back-to-school-vaccines/
News,Grand jury declines to indict woman in Emmett Till killing,https://www.houstonpublicmedia.org/articles/news/2022/08/09/430368/grand-jury-declines-to-indict-woman-in-emmett-till-killing/
News,Serena Williams says she intends to retire from tennis after the U.S. Open,https://www.houstonpublicmedia.org/articles/news/2022/08/09/430343/serena-williams-says-she-intends-to-retire-from-tennis-after-the-u-s-open/
Sports,"Texans lower prices on beer, soda, hot dogs, chicken tenders for 2022 season",https://www.houstonpublicmedia.org/articles/news/sports/2022/08/09/430300/texans-lower-prices-on-beer-soda-hot-dogs-chicken-tenders-for-2022-season/
Immigration,ACLU calls on feds to investigate Abbott’s policy transporting migrants back to border,https://www.houstonpublicmedia.org/articles/news/politics/immigration/2022/08/09/430295/aclu-calls-on-feds-to-investigate-abbotts-policy-transporting-migrants-back-to-border/
National,Houston woman charged with murder in crash that killed five,https://www.houstonpublicmedia.org/articles/news/national/2022/08/09/430281/houston-woman-charged-with-murder-in-crash-that-killed-five/
News,Trump says FBI agents searched his Mar-a-Lago home in Florida,https://www.houstonpublicmedia.org/articles/news/2022/08/09/430275/trump-says-fbi-agents-searched-his-mar-a-lago-home-in-florida/
Affordable Care Act,"Preventive care such as birth control, anti-HIV medicine challenged in Texas lawsuit",https://www.houstonpublicmedia.org/articles/news/health-science/affordable-care-act/2022/08/09/430269/preventive-care-such-as-birth-control-anti-hiv-medicine-challenged-in-texas-lawsuit/
Health & Science,Mental health issues among Texas children exacerbated by pandemic,https://www.houstonpublicmedia.org/articles/news/health-science/2022/08/09/430233/growing-mental-health-issues-among-kids-exacerbated-by-pandemic/
Houston Matters,"How the Inflation Reduction Act might affect Houston (Aug. 9, 2022)",https://www.houstonpublicmedia.org/articles/shows/houston-matters/2022/08/09/430042/how-the-inflation-reduction-act-addresses-climate-change-aug-9-2022/
Town Square,Social media culture and the power of influencers,https://www.houstonpublicmedia.org/articles/shows/town-square/2022/08/08/430237/social-media-culture-and-the-power-of-influencers/
Health & Science,New COVID vaccine option being administered through Harris County,https://www.houstonpublicmedia.org/articles/news/health-science/2022/08/08/430234/new-covid-vaccine-option-being-administered-through-harris-county/
Religion,Houston-area mosques increase security amidst recent killings in Albuquerque,https://www.houstonpublicmedia.org/articles/news/religion/2022/08/08/430230/houston-area-mosques-increase-security-amidst-recent-killings-in-albuquerque/
Energy & Environment,Katy issuing mandatory water restrictions amid ‘severe’ drought,https://www.houstonpublicmedia.org/articles/news/energy-environment/2022/08/08/430220/katy-issuing-mandatory-water-restrictions-amid-severe-drought/
Theatre & Film,1980s pop goddess Olivia Newton-John has died at age 73,https://www.houstonpublicmedia.org/articles/arts-culture/theatre-film/2022/08/08/430221/1980s-pop-goddess-olivia-newton-john-has-died-at-age-73/
Music,"Lizzo, Beyonce, and the ways and reasons musicians update offensive art",https://www.houstonpublicmedia.org/articles/arts-culture/music/2022/08/08/430180/lizzo-beyonce-and-the-ways-and-reasons-musicians-update-offensive-art/
Education News,Police presence will increase in some Houston-area districts as school year begins,https://www.houstonpublicmedia.org/articles/news/education-news/2022/08/08/430157/police-presence-will-increase-in-some-houston-area-districts-as-school-year-begins-with-vacancies/
Sports,New Harris County pickleball courts to open as interest in sport grows,https://www.houstonpublicmedia.org/articles/news/sports/2022/08/08/430150/new-harris-county-pickleball-courts-to-open-as-interest-in-sport-grows/
Economy,Texas remains a powerhouse in job growth even though hiring could slow later this year,https://www.houstonpublicmedia.org/articles/economy/2022/08/08/430147/texas-remains-a-powerhouse-in-job-growth-even-though-hiring-could-slow-later-this-year/
