section,title,url
Energy & Environment,Houston and Harris County plan to sue Union Pacific over 5th Ward pollution,https://www.houstonpublicmedia.org/articles/news/energy-environment/2022/07/27/429232/houston-harris-county-threaten-to-sue-union-pacific/
Energy & Environment,"Manchin, Schumer surprise with deal on climate change, healthcare",https://www.houstonpublicmedia.org/articles/news/energy-environment/2022/07/28/429287/manchin-schumer-surprise-with-deal-on-climate-change-healthcare/
Houston,New state law allows Houston neighborhoods to redact racist deed restriction,https://www.houstonpublicmedia.org/articles/news/houston/2022/07/27/429206/new-state-law-allows-houston-neighborhoods-to-redact-racist-deed-restriction/
Houston Matters,"Texas drought conditions could have extensive impacts, expert says",https://www.houstonpublicmedia.org/articles/news/weather/2022/07/27/429213/drought-conditions-could-have-other-impacts-expert-says/
Criminal Justice,"U.S. has offered Russia deal for Griner, officials say",https://www.houstonpublicmedia.org/articles/news/criminal-justice/2022/07/27/429233/u-s-has-offered-russia-deal-for-griner-officials-say/
Texas,Appeals court upholds Texas block on school mask mandates,https://www.houstonpublicmedia.org/articles/news/texas/2022/07/27/429204/appeals-court-upholds-texas-block-on-school-mask-mandates/
Health & Science,Houston man battling monkeypox looks forward to return to normalcy,https://www.houstonpublicmedia.org/articles/news/health-science/2022/07/26/429166/houston-man-battling-monkeypox-looks-forward-to-return-to-normalcy/
Houston Matters,A new law would require breaks for outside workers. Its sponsor says it’s long overdue,https://www.houstonpublicmedia.org/articles/shows/houston-matters/2022/07/26/429121/a-new-law-would-require-breaks-for-outside-workers-its-sponsor-says-its-long-overdue/
Houston Matters,"Other legal questions spawned by the Dobbs ruling (July 28, 2022)",https://www.houstonpublicmedia.org/articles/shows/houston-matters/2022/07/28/428993/other-legal-questions-spawned-by-the-dobbs-ruling-july-28-2022/
Town Square,"Disability Pride Month: Advocates feel the phrase ‘special needs’ has become a derogatory term, prefer the phrase be eliminated completely",https://www.houstonpublicmedia.org/articles/shows/town-square/2022/07/27/429236/disability-pride-month-advocates-feel-the-phrase-special-needs-has-become-a-derogatory-term-prefer-the-phrase-be-eliminated-completely/
International,Brittney Griner says she received ‘a fraction’ of translation at her arrest,https://www.houstonpublicmedia.org/articles/news/international/2022/07/27/429201/brittney-griner-says-she-received-a-fraction-of-translation-at-her-arrest/
Houston Matters,"Drought conditions, the week in politics, and the life of George H.W. Bush (July 27, 2022)",https://www.houstonpublicmedia.org/articles/shows/houston-matters/2022/07/27/428991/drought-conditions-the-week-in-politics-and-the-life-of-george-hw-bush-july-27-2022/
Town Square,"Monkeypox is ‘not an LGBTQ disease, it just happened to hit this community first’, says Houston resident",https://www.houstonpublicmedia.org/articles/shows/town-square/2022/07/26/429164/monkeypox-is-not-an-lgbtq-disease-it-just-happened-to-hit-this-community-first-says-houston-resident/
Weather,Texas heat forces some outdoor workers to modify schedules and adjust work patterns,https://www.houstonpublicmedia.org/articles/news/weather/2022/07/26/429150/texas-heat-forces-some-outdoor-workers-to-modify-schedules-and-adjust-work-patterns/
Texas,Uvalde’s Robb Elementary principal placed on administrative leave,https://www.houstonpublicmedia.org/articles/news/texas/2022/07/26/429132/uvaldes-robb-elementary-principal-placed-on-administrative-leave/
News,$2.4 million needed to address Bellaire aging infrastructure,https://www.houstonpublicmedia.org/articles/news/2022/07/26/429128/2-4-million-needed-to-address-bellaire-aging-infrastructure/
Elections,Texas lawmakers ordered to turn over redistricting records,https://www.houstonpublicmedia.org/articles/news/politics/elections/2022/07/26/429123/texas-lawmakers-ordered-to-turn-over-redistricting-records/
Criminal Justice,Brittney Griner’s Russian trial considers medicinal use of cannabis,https://www.houstonpublicmedia.org/articles/news/criminal-justice/2022/07/26/429103/brittney-griners-russian-trial-considers-medicinal-use-of-cannabis/
Health & Science,"Because of Texas abortion law, her wanted pregnancy became a medical nightmare",https://www.houstonpublicmedia.org/articles/news/health-science/2022/07/26/429096/because-of-texas-abortion-law-her-wanted-pregnancy-became-a-medical-nightmare/
Houston Matters,"Rep. Sylvia Garcia on paid rest breaks for construction workers (July 26, 2022)",https://www.houstonpublicmedia.org/articles/shows/houston-matters/2022/07/26/428989/rep-sylvia-garcia-on-paid-rest-breaks-for-construction-workers-july-26-2022/
Town Square,"Texas celebrity chef Tiffany Derry talks new show, ‘The Great American Recipe’ airing on PBS",https://www.houstonpublicmedia.org/articles/shows/town-square/2022/07/25/429078/texas-celebrity-chef-tiffany-derry-talks-new-show-the-great-american-recipe-airing-on-pbs/
Health & Science,Monkeypox cases rise to 57 as local leaders plead for more vaccines,https://www.houstonpublicmedia.org/articles/news/health-science/2022/07/25/429058/monkeypox-cases-rise-to-57-local-leaders-call-for-more-vaccines/
Energy & Environment,Community activists hopeful for change after DOJ launches investigation into illegal dumping,https://www.houstonpublicmedia.org/articles/news/energy-environment/2022/07/25/429059/community-activists-hopeful-for-change-after-doj-launches-investigation-into-illegal-dumping/
Health & Science,Houston doctor suspended for vaccine misinformation files $25 million defamation lawsuit against Methodist Hospital,https://www.houstonpublicmedia.org/articles/news/health-science/2022/07/25/429010/houston-doctor-suspended-for-vaccine-misinformation-files-25-million-defamation-lawsuit-against-methodist-hospital/
News,Woman shot by Dallas Police after opening fire at Dallas Love Field,https://www.houstonpublicmedia.org/articles/news/2022/07/25/429062/woman-shot-by-dallas-police-after-opening-fire-at-dallas-love-field/
Sports,"Recovery from rare leukemia could be quick for Texans’ John Metchie III, cancer experts say",https://www.houstonpublicmedia.org/articles/news/sports/2022/07/25/429043/recovery-from-rare-leukemia-could-be-quick-for-texans-john-metchie-iii-cancer-experts-say/
Weather,Thunderstorms could be on the way. But scorching temps here to stay,https://www.houstonpublicmedia.org/articles/news/weather/2022/07/25/429044/thunderstorms-could-be-on-the-way-but-scorching-temps-here-to-stay/
Criminal Justice,Do police officers view themselves differently as public perception of them changes?,https://www.houstonpublicmedia.org/articles/news/criminal-justice/2022/07/25/429032/do-police-officers-view-themselves-differently-as-public-perception-of-them-changes/
Education,Harris County students will have equine therapy center in the coming years,https://www.houstonpublicmedia.org/articles/education/2022/07/25/429025/harris-county-students-will-have-equine-therapy-center-this-school-year/
Sports,"San Antonio, Houston and Arlington chosen for XFL reboot",https://www.houstonpublicmedia.org/articles/news/sports/2022/07/25/428975/san-antonio-houston-and-arlington-chosen-for-xfl-reboot/
Energy & Environment,Gasoline prices are soaring well above the price of crude oil. Here’s why,https://www.houstonpublicmedia.org/articles/news/energy-environment/2022/07/25/428811/gasoline-prices-are-soaring-well-above-the-price-of-crude-oil-heres-why/
Houston Matters,"Race and Houston’s response to illegal dumping (July 25, 2022)",https://www.houstonpublicmedia.org/articles/shows/houston-matters/2022/07/25/428660/race-and-houstons-response-to-illegal-dumping-july-25-2022/
