section,title,url
Texas,Ex-DPS officer hired by Uvalde Schools fired after CNN report,https://www.houstonpublicmedia.org/articles/news/texas/2022/10/06/434690/ex-dps-officer-hired-by-uvalde-schools-fired-after-cnn-report/
Education,Katy ISD high school students can now access LGBTQ+ suicide prevention resources. Advocates want more.,https://www.houstonpublicmedia.org/articles/education/2022/10/06/434553/katy-isd-high-school-students-can-now-access-lgbtq-suicide-prevention-resources-advocates-want-more/
Sports,"Houston Rockets, Harris County constable team up for Hurricane Ian relief drive",https://www.houstonpublicmedia.org/articles/news/sports/2022/10/06/434648/houston-rockets-harris-county-constable-team-up-for-hurricane-ian-relief-drive/
Sports,City to host rally for Houston Astros as 2022 postseason begins,https://www.houstonpublicmedia.org/articles/news/sports/2022/10/06/434659/city-to-host-rally-for-astros-as-they-enter-the-postseason/
Education,Texas Education Agency’s push to take over Houston ISD reaches Texas Supreme Court,https://www.houstonpublicmedia.org/articles/education/2022/10/06/434643/texas-education-agencys-push-to-take-over-houston-isd-reaches-state-supreme-court/
Law Enforcement,"Nonprofit buys 19 billboards throughout Houston area in support of police, firefighters",https://www.houstonpublicmedia.org/articles/law-enforcement/2022/10/06/434655/nonprofit-buys-19-billboards-throughout-houston-area-in-support-of-police-firefighters/
City of Houston,Houston City Council approves new tax rate; Turner says voters could decide on adjusting revenue cap,https://www.houstonpublicmedia.org/articles/news/city-of-houston/2022/10/06/434636/as-city-council-approves-new-tax-rate-mayor-turner-says-voters-could-decide-on-adjusting-revenue-cap/
International,Brittney Griner’s wife says WNBA star is at “weakest moment” before final hearing could send her to a Russian labor camp,https://www.houstonpublicmedia.org/articles/news/international/2022/10/06/434630/brittney-griners-wife-says-wnba-star-is-at-weakest-moment-before-final-hearing-could-send-her-to-a-russian-labor-camp/
Criminal Justice,Biden to pardon simple federal marijuana possession convictions,https://www.houstonpublicmedia.org/articles/news/criminal-justice/2022/10/06/434686/biden-to-pardon-simple-federal-marijuana-possession-convictions/
Town Square,Lauren Anderson: A Trailblazer in Dance,https://www.houstonpublicmedia.org/articles/shows/town-square/2022/10/06/434669/lauren-anderson-a-trailblazer-in-dance/
Health & Science,"Over 2 million teens have tried vaping leading to more lung-related diseases, according to CDC",https://www.houstonpublicmedia.org/articles/news/health-science/2022/10/06/434671/over-2-million-teens-have-tried-vaping-leading-to-more-lung-related-diseases-according-to-cdc/
Party Politics,When Harry Met Beto,https://www.houstonpublicmedia.org/articles/shows/party-politics/2022/10/06/434647/when-harry-met-beto/
Immigration,DACA remains intact as appeals court sends case challenging its legality back to lower court in Texas,https://www.houstonpublicmedia.org/articles/news/politics/immigration/2022/10/06/434634/daca-remains-intact-as-appeals-court-sends-case-challenging-its-legality-back-to-lower-court-in-texas/
Houston Matters,"Deaths at the Harris County Jail, and the president of the NAACP (Oct. 6, 2022)",https://www.houstonpublicmedia.org/articles/shows/houston-matters/2022/10/06/434308/deaths-at-the-harris-county-jail-and-the-president-of-the-naacp-oct-6-2022/
Harris County,Harris County Judge Lina Hidalgo ‘recuperating’ after emergency room visit,https://www.houstonpublicmedia.org/articles/news/harris-county/2022/10/05/434606/harris-county-judge-lina-hidalgo-recuperating-after-emergency-room-visit/
Texas,Houston-area convenience store reaps some rewards after selling $19 million Lotto Texas winning ticket,https://www.houstonpublicmedia.org/articles/news/texas/2022/10/05/434600/houston-area-convenience-store-reaps-rewards-after-selling-19-million-lotto-texas-winning-ticket/
Criminal Justice,"2 people die at Harris County Jail, marking highest number of deaths in the past decade",https://www.houstonpublicmedia.org/articles/news/criminal-justice/2022/10/05/434533/2-people-died-at-harris-county-jail-marking-the-highest-number-of-deaths-in-the-past-decade/
Transportation,"Houston’s airports should have better road conditions, more gates as work continues",https://www.houstonpublicmedia.org/articles/news/transportation/2022/10/05/434572/houstons-airports-should-have-better-road-conditions-more-gates-as-work-continues/
Criminal Justice,Harris County courts backlog continues amid finger pointing,https://www.houstonpublicmedia.org/articles/news/criminal-justice/2022/10/05/434557/harris-county-courts-backlog-continues-amid-finger-pointing/
News,LULAC raises reward amount for information on woman who allegedly lured migrants away from Texas,https://www.houstonpublicmedia.org/articles/news/2022/10/05/434554/lulac-raises-reward-amount-for-information-on-woman-who-allegedly-lured-migrants-away-from-texas/
Texas,Hispanic students were once segregated at this school. Now it will be a historic site,https://www.houstonpublicmedia.org/articles/news/texas/2022/10/05/434546/hispanic-students-were-once-segregated-at-this-school-now-it-will-be-a-historic-site/
Texas,Attorney General Ken Paxton ordered to testify in abortion lawsuit after evading subpoena,https://www.houstonpublicmedia.org/articles/news/texas/2022/10/05/434536/attorney-general-ken-paxton-ordered-to-testify-in-abortion-lawsuit-after-evading-subpoena/
Houston Matters,The Full Menu: Never skip dessert at these Houston restaurants,https://www.houstonpublicmedia.org/articles/shows/houston-matters/2022/10/05/434436/the-full-menu-never-skip-dessert-at-these-houston-restaurants/
Houston Matters,"Compromise offered over county budget, and restaurants where you should never skip dessert (Oct. 5, 2022)",https://www.houstonpublicmedia.org/articles/shows/houston-matters/2022/10/05/434306/compromise-offered-over-county-budget-and-restaurants-where-you-should-never-skip-dessert-oct-5-2022/
Housing,"Columbia Tap Trail to receive $150,000 in renovations",https://www.houstonpublicmedia.org/articles/housing/2022/10/04/434470/columbia-tap-trail-to-receive-150000-in-renovations/
Town Square,Hadestown and Tony-Award winning actor André De Shields,https://www.houstonpublicmedia.org/articles/shows/town-square/2022/10/04/434476/hadestown-and-tony-award-winning-actor-andre-de-shields/
Arts & Culture,"Houston Toy Museum aims to brighten lives for kids, adults alike",https://www.houstonpublicmedia.org/articles/news/arts-culture-news/2022/10/04/434480/upcoming-houston-toy-museum-aims-to-brighten-lives-for-kids-adults-alike/
Politics,Cagle offers a compromise to resolve Harris County’s tax and budget deadlock,https://www.houstonpublicmedia.org/articles/news/politics/2022/10/04/434479/cagle-offers-a-compromise-to-resolve-harris-countys-tax-and-budget-deadlock/
Police,National Night Out events to take place Tuesday night throughout Houston area,https://www.houstonpublicmedia.org/articles/police/2022/10/04/434456/national-night-out-events-to-take-place-tuesday-night-throughout-houston-area/
Harris County,How rhetoric about bail reform is shaping the upcoming election in Harris County,https://www.houstonpublicmedia.org/articles/news/harris-county/2022/10/04/434454/how-rhetoric-about-bail-reform-is-shaping-the-upcoming-election-in-harris-county/
Music,"Loretta Lynn, country music icon, has died at 90",https://www.houstonpublicmedia.org/articles/arts-culture/music/2022/10/04/434450/loretta-lynn-country-music-icon-has-died-at-90/
Town Square,"Bringing awareness to breast cancer, plus a discussion on Friday’s Texas Gubernatorial debate",https://www.houstonpublicmedia.org/articles/shows/town-square/2022/10/04/434432/bringing-awareness-to-breast-cancer-plus-a-discussion-on-fridays-texas-gubernatorial-debate/
